id,name,brand_id,retailer_id,feature_description,detailed_description,product_link,affiliate_link,min_age,max_age,male,female,picture,detail_picture,min_price,max_price
589,Write and Learn Creative Center		,367,1,The write and learn creative center provides children with an interactive & fun way to give them a head start writing,The write and learn creative center provides children with an interactive & fun way to give them a head start writing. Animated demonstrations allow children to follow along and learn proper stroke order for uppercase and lowercase letters. ,https://www.amazon.com/dp/B00XUZH4LK/?tag=outgift00-20,https://www.amazon.com/dp/B00XUZH4LK/?tag=outgift00-20,3,4,true,true,a69eb381-09dd-4b16-a446-fa9905d991ac.png,3c5568e5-97ae-4a62-88c9-739b0dd35608.jpg,25,36
590,Personal USB Humidifier,368,1,This compact humidifier has a unique design that combines the function of an essential oil diffuser and humidifier into one,This compact humidifier has a unique design that combines the function of an essential oil diffuser and humidifier into one. It's whisper quiet and is perfect for the bedroom or office. Multiple color options available.,http://www.amazon.com/dp/B075WQPC3V/?tag=outgift00-20,http://www.amazon.com/dp/B075WQPC3V/?tag=outgift00-20,18,100,true,true,972d8879-c941-45f0-b4a3-050ad95c4aca.png,9daa147e-0e1e-4c48-9548-8dc9ec489575.jpg,20,30
591,Chelsea Furnished Cottage,305,1,This adorable dollhouse comes with 17 pieces of furniture making it perfect for any young girl with a wild imagination,This adorable dollhouse comes with 17 pieces of furniture making it perfect for any young girl with a wild imagination. It has two molded plastic staircases and windows that open and close.,https://www.amazon.com/dp/B003ADVR3S/?tag=outgift00-20,https://www.amazon.com/dp/B003ADVR3S/?tag=outgift00-20,3,8,false,true,a1671179-feaf-4add-9e0b-f5199c16d678.png,ecd72389-e8ea-4c2c-9646-b3400377de25.jpg,60,65
592,XOXO Candy Bento,53,30,"This signature V-Day gift includes lucite cubes of love-inspired candies with sweet little sayings, all in a bento box","This signature V-Day gift includes lucite cubes of love-inspired candies with sweet little sayings. Choose from 2, 3, 4 and 8-piece DIY sets.",https://www.sugarfina.com/gift-shop/occasion/valentines-day,http://fxo.co/5cvH,11,100,true,true,ab757c6f-c71a-4d84-996d-ae67e0240660.png,81ae939e-18e1-4ea6-9218-fca2164659f1.jpg,20,65
593,Little Sweets & Socks,53,30,Treat tummies and toes with this adorable bento box pair of Baby Champagne Bears with a matching set of baby socks,Treat tummies and toes with this adorable bento box pair of Baby Champagne Bears with a matching set of baby socks,https://www.sugarfina.com/lil-sweets-socks-bento-box,http://fxo.co/592P,18,44,true,true,51c7ddb6-1238-4cba-b9f3-d7438cc33b07.png,81199fec-0c47-4966-a408-2d7da6acb770.jpg,20,20
594,Happy Birthday 4-pc Bento,53,30,This Bento Box includes four cubes of all the candies to make someone’s special birthday that much sweeter,"This Bento Box includes four cubes of all the candies to make someone’s special birthday that much sweeter. It includes Birthday Cake Caramels, gummy Ice Cream Cones, Champagne Bears and sweet and sour Sugar Lips.",https://www.sugarfina.com/happy-birthday-4pc-bento-box,http://fxo.co/592M,15,100,true,true,372118f3-083a-4915-ba16-f57795c50f9b.png,dd39a16a-2c9d-4414-8cce-38dc0d47ec94.jpg,34,34
596,Luna Go Brush,369,1,This compact facial cleaning brush delivers full cleansing and anti-aging routines,Luna Go delivers full cleansing and anti-aging routines and its compact size make it the perfect beauty companion on the go.  Multiple color options available.,http://www.amazon.com/dp/B01I4CZY4W/?tag=outgift00-20,http://www.amazon.com/dp/B01I4CZY4W/?tag=outgift00-20,18,100,false,true,89748444-12c0-4966-837b-7a3d45bfa05c.png,709aa252-edc2-438f-8a9e-f5bbda76bd15.jpg,99,99
597,Reusable Shopping Bag,370,1,"This reusable, eco-friendly, long lasting and stylish bag is not just for the grocery store","This reusable, Eco-friendly, long lasting and stylish bag is not just for the grocery store. It comes in multiple fun color options and can hold up to 50 lbs.",http://www.amazon.com/dp/B072DVVJBT/?tag=outgift00-20,http://www.amazon.com/dp/B072DVVJBT/?tag=outgift00-20,35,100,false,true,f1503511-51c2-47e9-925b-a076664f4688.png,8c0863de-2d43-4d2d-acce-f9d91ba336fb.jpg,10,10
598,International Aluminum Carry-On,29,14,"Striking up close or from a distance, this super durable carry-on is made for short trips in international destinations","Striking up close or from a distance, this super durable carry-on is made for short trips in international destinations. In features two mesh zip pockets, tie-down straps on both front and back compartments, one card pocket and even comes with vintage-inspired destination stickers.  It comes in multiple colors and can even be monogrammed.",https://www.tumi.com/p/international-carry-on-036860MD2,http://fxo.co/4nH4,18,100,true,true,bf5d08a5-f351-4669-ad08-d1e977da07ea.png,0bab664e-a723-43f7-af58-67da8b345a55.jpg,995,995
599,Geometrics Doll House,344,1,"This dollhouse has triangle, rectangle, and polygon shaped rooms that can be rearranged for a different design every time","This dollhouse has triangle, rectangle, and polygon shaped rooms that can be rearranged for a different design every time",https://www.amazon.com/dp/B00OPDCM18/?tag=outgift00-20,https://www.amazon.com/dp/B00OPDCM18/?tag=outgift00-20,3,8,true,true,9ad3f497-887d-4ac0-855b-d4afa5eabaa8.png,46004e4d-f164-44a0-aff3-4defeb5fd331.jpg,34,43
600,Exploding Kittens Card Game,356,1,"In this highly-strategic, kitty-powered version of Russian Roulette, players draw cards until an Exploding Kitten is drawn","In this highly-strategic, kitty-powered version of Russian Roulette, players draw cards until an Exploding Kitten is drawn. It's a must have for their next dinner party.",https://www.amazon.com/dp/B010TU7LP2/?tag=outgift00-20,https://www.amazon.com/dp/B010TU7LP2/?tag=outgift00-20,18,34,true,true,5de82219-f028-4633-9c0c-d827fbc19c8a.png,2d0fea05-bfb3-4622-8cb2-67c5b806a473.jpg,15,20
601,Cards Against Humanity,356,1,This renown card game is hailed as one of the funniest and well reviewed card games of all time,"This renown card game is hailed as one of the funniest and well reviewed card games of all time. Rules are simple - each round, one player asks a question from a Black Card, and everyone else answers with their funniest White Card. ",https://www.amazon.com/dp/B004S8F7QM/?tag=outgift00-20,https://www.amazon.com/dp/B004S8F7QM/?tag=outgift00-20,18,44,true,true,0ede39cb-3c16-4c4b-92ac-579ad5d78864.png,016324c3-8a6b-402a-a258-a91b16df201f.jpg,25,25
602,Winston Shave Set,371,122,"Everything they need for a close, comfortable shave wrapped up in sleek packaging","Everything they need for a close, comfortable shave wrapped up in sleek packaging. Set comes with 1 Winston Razor Handle, 1 Foaming Shave Gel (4.0oz), 3 German Engineered Blade Cartridges and 1 Travel Blade Cover.",https://www.harrys.com/en/us/products/the-winston-set,http://bit.ly/2G1ylZD,18,54,true,false,637bf496-fea2-424a-8760-d28b0deed7ac.png,f7debc86-752c-4e9e-916f-5e3c486e1d02.jpg,25,25
603,Bluetooth Cat Earphones		,372,1,"These fun, durable earphones have detachable cat ears","These fun, durable earphones have detachable cat ears so they can enjoy high quality sound while looking cute",http://www.amazon.com/dp/B01M18X04S/?tag=outgift00-20,http://www.amazon.com/dp/B01M18X04S/?tag=outgift00-20,11,17,false,true,d03e088a-89e0-4860-b2a1-c9029faa91b4.png,c93600ef-4b1a-403e-a93f-45b14d9a6688.png,80,90
604,Trusty Tow Truck,303,1,This classic BRIO tow truck set simulates real-life tilting action with magnetic couplings,This classic BRIO tow truck set simulates real-life tilting action with magnetic couplings.  It is fully compatible with all BRIO wooden road and railway sets.,https://www.amazon.com/dp/B00000IUQG/?tag=outgift00-20,https://www.amazon.com/dp/B00000IUQG/?tag=outgift00-20,3,8,true,true,677dc240-6634-42db-a93a-9f88d2f61d87.png,e41d18cb-25f2-45c4-a6a4-9244a37efa92.jpg,12,12
606,Baby NFL Beanie,163,28,Supporting your favorite team isn't just for adults - these official NFL beanies are made specifically for babies,Supporting your favorite team isn't just for adults - these official NFL beanies are made specifically for babies,http://www.nflshop.com/Pittsburgh_Steelers_Gear/Girls_Infant_Pittsburgh_Steelers_New_Era_Gray_Black_Heathered_Tot_Dub_Knit_Beanie,http://shrsl.com/wip2,0,1,true,true,c5f9faf3-7851-4b40-bb70-ad57c9edf764.png,30c77b3f-9078-4175-b836-a4022f06ff03.jpg,10,15
607,Kids MLB Jersey,374,124,Supporting your favorite team isn't just for adults - these official MLB jerseys are made specifically for kids,Supporting your favorite team isn't just for adults - these official MLB jerseys are made specifically for kids,http://shrsl.com/mp4b,http://shrsl.com/mp4b,1,10,true,true,219a3faf-4123-4359-83a9-9acf6aad97be.png,732b6759-7627-44de-9d57-fff4feca0161.jpg,40,40
608,Baby MLB Jersey,374,124,Supporting your favorite team isn't just for adults - these official MLB jerseys are made specifically for babies,Supporting your favorite team isn't just for adults - these official MLB jerseys are made specifically for babies,http://shrsl.com/mp49,http://shrsl.com/mp49,0,1,true,true,d386ad49-e5df-469e-895b-8f0d3c41ef70.png,29c9aa22-b425-45a3-ac44-70581dd91bd0.jpg,40,40
609,Kids MLB Hat,374,124,Supporting your favorite team isn't just for adults - these official MLB hats are made specifically for kids,Supporting your favorite team isn't just for adults - these official MLB hats are made specifically for kids.,http://shrsl.com/mp47,http://shrsl.com/mp47,2,10,true,true,7e126add-302e-4143-af60-df543c64362c.png,d80a20c6-8aba-4e9e-b901-943e30a1dd7e.jpeg,12,29
611,Kids NFL Beanie,163,28,Supporting your favorite team isn't just for adults - these official NFL hats are made specifically for kids,Supporting your favorite team isn't just for adults - these official NFL hats are made specifically for kids,http://shrsl.com/mouy,http://shrsl.com/mouy,1,10,true,true,fb4fcdd4-a975-49cd-aebf-a9d2ec6f885a.png,1d517fd8-ec1d-4ea6-b3a5-b158a483f249.jpg,15,20
612,Kids NFL Jersey,163,28,These official NFL jerseys are made specifically for kids and can even be personalized,Supporting your favorite team isn't just for adults - these official NFL jerseys are made specifically for kids and can even be personalized.,http://shrsl.com/mouz,http://shrsl.com/mouz,1,10,true,true,1168b661-ebbb-422c-90a9-d939554eb6bf.png,5ef2e12a-e61e-4a6f-a0c8-93068ebfb09b.jpeg,55,75
613,Baby NFL Jersey,163,28,Supporting your favorite team isn't just for adults - these official NFL jerseys are made specifically for babies,Supporting your favorite team isn't just for adults - these official NFL jerseys are made specifically for babies,http://www.nflshop.com/New_England_Patriots_Kids_Newborn_And_Infant/Newborn_And_Infant_New_England_Patriots_Tom_Brady_Navy_Mainliner_Name_And_Number_Bodysuit,http://shrsl.com/u4p9,0,1,true,true,61664792-3184-49b5-a287-df2146bf7b68.png,cd95739e-1890-4ba2-b3a9-9b0b023020c3.jpeg,20,30
614,Baby NBA Jersey,373,125,Supporting your favorite team isn't just for adults - these official NBA jerseys are made specifically for babies,Supporting your favorite team isn't just for adults - these official NBA jerseys are made specifically for babies,http://shrsl.com/mp44,http://shrsl.com/mp44,0,1,true,true,cae79773-dadc-4b36-98c5-41a59f4f4b89.png,6656a04a-9ef9-4c4e-bf61-ebb4fd2d5576.jpg,17,17
617,Kids NBA Jersey,373,125,Supporting your favorite team isn't just for adults - these official NBA jerseys are made specifically for kids,Supporting your favorite team isn't just for adults - these official NBA jerseys are made specifically for kids,http://store.nba.com/Brooklyn_Nets_Kids_Jerseys,http://store.nba.com/Brooklyn_Nets_Kids_Jerseys,1,10,true,true,fcdb5495-2379-454d-8cb2-b89ac8be87fa.png,178780f3-6f4a-43f6-8199-83ece0bb45e7.jpg,25,25
618,Brass Easel & Calendar,210,80,Just add 12 of your favorite photos to create a custom and beautifully designed calendar atop a solid brass easel,Just add 12 of your favorite photos to create a custom and beautifully designed calendar atop a solid brass easel,https://www.artifactuprising.com/photo-calendars/brass-easel-desk-calendar,http://shrsl.com/moid,18,100,true,true,bc0ee09b-c78d-4759-a2d5-fd29f7fb77f8.png,c020f534-1a9d-4a25-9624-a4f5603431ce.jpg,55,55
619,Softcover Photo Book,210,80,"These premium, custom soft cover photo books are a perfect way to display memories on their coffee table","These premium, custom photo books, with a variety of cover designs to choose from, are acclaimed for the quality of the cover stock ",https://www.artifactuprising.com/photo-books/softcover-books,http://shrsl.com/moiq,18,100,true,true,1fbf29df-060a-4ec9-b554-afd52e1cfb29.png,71b02aa8-c0b7-4156-b487-c82f2d848e50.jpg,15,39
620,Wood Block & Prints,210,80,Make it a well-dressed desk with this rotating custom photo display,Make it a well-dressed desk with this rotating custom photo display that sits atop a simple but sleek wood block,https://www.artifactuprising.com/photo-prints/wood-block-photo-prints,http://shrsl.com/moiu,18,100,true,true,616f665c-2c1b-4518-ae9a-5c3948d49205.png,3bbe6f8e-fe0a-49e4-9108-259d95088067.jpg,20,25
621,Wooden Print Hanger with Print,210,80,"A versatile alternative to traditional framing, the Wooden Print Hanger is an easy-to-use display for favorite photos","A versatile alternative to traditional framing, the Wooden Print Hanger is an easy-to-use display for favorite photos.  It's made in the USA from real maple wood with solid brass hardware and comes with a Large Format Fine Art Print included.",https://www.artifactuprising.com/photo-holders/wooden-print-hanger-with-print,http://shrsl.com/moiw,21,100,true,true,54715c49-7fcf-49fb-9577-58804236d9db.png,7a27d3d8-8c2d-4a3f-939a-6ea3e05d9af6.jpg,89,109
622,Custom Float Frame,210,80,This minimalist and beautiful statement piece with a custom photo and its sleek brass-coated bolts arrives ready to hang,The Float Frame from Artifact Uprising is minimalist and beautiful statement piece with its sleek brass-coated bolts. Just choose the photo to be printed on premium archival paper and it arrives fully finished and ready to hang.,https://www.artifactuprising.com/frames/float-frame,http://shrsl.com/moix,21,100,true,true,0dcd1a9c-f999-40be-a2e2-62443fa6f11b.png,c6f1df52-2982-4970-b746-3bd1a193127c.jpg,79,349
623,Brass Geo Rail & Prints,210,80,This weighted solid brass stand + print is a substantial yet understated addition to any design-lover’s desk,"This weighted solid brass stand + print is a substantial yet understated addition to any design-lover’s desk. It comes with 10 customizable 5 x 5"" Everyday Prints.",https://www.artifactuprising.com/photo-holders/geo-rail-and-prints,http://shrsl.com/moiz,21,100,true,true,8a501e7a-07bb-4bd0-bdf5-adc20a7ae049.png,a4114896-4958-4b33-87e7-9c415d54786d.jpg,50,50
624,Walnut Block & Prints,210,80,This limited edition Walnut Print Block is handcrafted from reclaimed black walnut found in the Colorado forests,"This limited edition Walnut Print Block is handcrafted from reclaimed black walnut found in the Colorado forests.   It comes with 10 customizable 5 x 5"" Everyday Prints",https://www.artifactuprising.com/photo-holders/walnut-block-photo-prints,http://shrsl.com/moj2,21,100,true,true,e9f060ce-8d9e-4bcf-8b99-82f32dffd6ec.png,f708aef1-aab3-4e2a-be60-6660dcfb325d.jpg,30,30
625,Solidwool Calendar,210,80,"Using fleece from upland UK sheep, Solidwool has created a unique, sustainable and beautiful composite — now brought to life ","Using fleece from upland UK sheep, Solidwool has created a unique, sustainable and beautiful composite — now brought to life as a clipboard.   It comes customized with 12 premium quality custom prints.",https://www.artifactuprising.com/photo-calendars/custom-photo-solidwool-calendar,http://shrsl.com/mou5,18,100,true,true,b19402d7-ae28-4702-83f7-ecc23bacc89e.png,4590edbe-569d-436e-ba94-eaedea7931d2.jpg,40,40
626,Chain Leather Wallet,116,17,This gorgeous leather wallet doubles as a purse with a detachable chain crossbody strap and multiple interior pockets,This gorgeous leather wallet doubles as a purse with a detachable chain crossbody strap and multiple interior pockets,https://www.bloomingdales.com/shop/product/tory-burch-robinson-chain-leather-wallet?ID=1688652&CategoryID=1002730#fn=ppp%3Dundefined%26sp%3D1%26rId%3D118%26spc%3D131%26cm_kws%3Dtory%2520burch%26spp%3D32%26pn%3D1%7C2%7C32%7C131%26rsid%3Dundefined,http://fxo.co/52eZ,21,34,false,true,155f7f9f-8b48-4b40-bd5d-43148b890bd0.png,3e964f2d-140d-46e3-ba8e-0b8a53fe9a5a.jpg,298,298
627,Cameron Crossbody,87,65,"This cute, scratch-resistant crosshatched leather purse wipes clean easily and can be personalized","This cute, scratch-resistant crosshatched leather purse wipes clean easily and can be personalized with custom embossing. Multiple color options available.",https://www.katespade.com/products/cameron-street-hope-crossbody/098687152488.html,https://outgift.co/2sEz5Po,16,44,false,true,e25229c4-8345-4567-a25c-4af11b3cdf65.png,518fe796-63e4-47b0-9d24-cdd721f1034d.jpg,139,139
628,Cameron Lotte,87,65,"This bag can be worn cross body or carried in hand, its versatile size and luxe leather will make it their go-to bag","This bag can be worn cross body or carried in hand, its versatile size, luxe leather and gold hardware will make it their go-to purse. Multiple color options available. ",https://www.katespade.com/products/cameron-street-lottie/098687159692.html,http://fxo.co/573i,18,100,false,true,addb6433-fbea-4425-ae93-0c28fbe5455c.png,8f91466d-ed94-4200-9892-0b66a52759e4.jpeg,230,230
629,Cameron Jensen Tote,87,32,"This stylish tote has a roomy, 3-part interior that's big enough for a 13-inch laptop, making it the perfect wear-to-work bag","This stylish tote has a roomy, 3-part interior that's big enough for a 13-inch laptop, making it the perfect wear-to-work bag. Multiple color options available.",https://shop.nordstrom.com/s/kate-spade-new-york-cameron-street-jensen-leather-tote/4538544,http://fxo.co/5giF,18,100,false,true,253b5497-881f-4560-a3b7-eba22727cf63.png,455d0128-2eb8-4b08-a672-0d194cbbedb5.jpg,265,265
630,Bow Gloves,87,65,Sweet bows adorn the back of these cozy wool blend gloves,Sweet bows adorn the back of these cozy wool blend gloves. Multiple color options available. ,https://www.katespade.com/products/bow-gloves/KS1001121.html,http://fxo.co/4muK,16,100,false,true,2b02fe1f-ab33-4728-8aa4-6791d9f22bae.png,6a004418-e012-431a-bff5-1770150d12e3.jpeg,30,30
631,Watson Yoga Bag,87,65,"This yoga bag, constructed from a durable nylon, totes a change of clothes, a water bottle, and anything else she needs","This yoga bag, constructed from a durable nylon, totes a change of clothes, a water bottle, and anything else she needs. ",https://www.katespade.com/products/watson-lane-yoga-bag/PXRU8249.html,http://fxo.co/4ms0,21,100,false,true,6b8b1e09-6908-45c3-94a3-06d3f0ef28e7.png,e466747c-c4af-4bd7-9883-6b39c207a346.jpg,298,298
632,Make It Mine Camila Purse,87,65,This rounded convertible crossbody is made of crosshatched leather and can be customized from the flap to straps,"This rounded convertible crossbody is made of crosshatched leather and can be customized with your choice of bag flap, straps, tassels, charms and more. Multiple color options available.",https://www.katespade.com/products/make-it-mine-camila/098687157063.html,http://fxo.co/4ms2,16,44,false,true,dc6383c0-1a45-4de7-9501-a7874c20cba3.png,79ccc866-9911-4165-8d38-aa97e6114c63.jpg,258,258
633,Thermal Sleepshirt,87,65,"This cute thermal, crew neck sleepshirt has long sleeves with ribbed cuffs and reads ""In Your Dreams""","This cute thermal, crew neck sleepshirt has long sleeves with ribbed cuffs and reads ""In Your Dreams""",https://www.katespade.com/products/thermal-sleepshirt/5021455.html,http://fxo.co/4ms4,16,44,false,true,390db7c2-fc56-4e76-8913-9f20269a4a08.png,62057ef5-1992-4b1a-8d8e-89224971089a.jpg,48,48
634,Thermal PJ Set,87,65,"This two-piece thermal pajama set will keep her cozy with a friendly reminder that ""Baby It's Cold Outside"" ","This two-piece thermal pajama set will keep her cozy with a friendly reminder that ""Baby It's Cold Outside"" ",https://www.katespade.com/products/thermal-pj-set/5071455.html,http://fxo.co/4ms5,18,44,false,true,ee1e7f7e-f71e-4fa2-a522-a0d00d90ad9e.png,394412e0-d365-4173-be5c-f9bea1d3828a.jpg,78,78
635,Hey Baby Frame,87,1,There's no sweeter gift than a silver picture frame that captures those precious moments in a little one's life,"There's no sweeter gift than a silver picture frame that captures those precious moments in a little one's life. It comes in a Kate Spade branded box, ready to be gifted. ",https://www.amazon.com/dp/B0759764JK/?tag=outgift00-20,https://www.amazon.com/dp/B0759764JK/?tag=outgift00-20,18,44,true,true,378e0171-dedb-490e-ba76-31334c16585a.png,d75c1713-050e-4895-bac4-22c40df5f767.jpg,50,50
636,Rose Robe,87,65,"This chic, blush rose short robe boasts a classic design and is perfect for cozying up","This chic, blush rose short robe boasts a classic design and is perfect for cozying up",https://www.bloomingdales.com/shop/product/kate-spade-new-york-robe?ID=2803067&CategoryID=21429#fn=BRAND%3Dkate%20spade%20new%20york%26ppp%3Dundefined%26sp%3D1%26rId%3D107%26spc%3D45%26spp%3D13%26pn%3D1%7C1%7C13%7C45%26rsid%3Dundefined,http://fxo.co/572y,18,54,false,true,4f08e313-34d4-4761-b712-ee009e0fdbc2.png,40645c57-670b-4002-b6f1-52ab03c201c0.jpeg,78,78
637,Charmeuse Robe,87,65,This kimono style charmeuse robe with lace trim adds a dash of glamour to her nightly routine,This kimono style charmeuse robe with lace trim adds a dash of glamour to her nightly routine,https://www.katespade.com/products/charmeuse-robe/5041465.html,http://fxo.co/4ms7,18,44,false,true,fad4bef2-9667-4265-8aee-52a8f4e97233.png,835513d1-8a47-46c4-b584-b93455010e8d.jpg,70,70
638,Shine On Flower Studs,87,65,"These shiny 12-karat gold plated, enamel and glass flower studs are good for every day and evenings out","These shiny 12-karat gold plated, enamel and glass flower studs are modern enough to be wearable everyday, but still special enough for evenings out. Multiple color options available.",https://www.katespade.com/products/shine-on-flower-studs/WBRUE242.html,http://fxo.co/4ms9,18,100,false,true,ffab844d-a74e-4c5f-869f-054760969f21.png,4846c95f-368b-42e3-8691-4f4b3c1c0551.jpg,38,38
639,Signature Mini Studs,87,65,These gold plated studs carry the classic Kate Spade symbol,These gold plated studs carry the classic Kate Spade symbol,https://www.katespade.com/designer-jewelry/designer-earrings/kate-spade-mini-studs/WBRU3916.html,http://fxo.co/4msA,13,100,false,true,9b0c4fde-1a97-4370-8e1b-fb4a4c3afa64.png,161121a5-c1b8-4f50-a4af-cc3df8748091.jpg,32,32
640,Save The Date Studs,87,65,These shiny gold plated and glass stone earrings are perfect and playful for the bride-to-be,These shiny gold plated and glass stone earrings are perfect and playful for the bride-to-be,https://www.katespade.com/products/save-the-date-mrs.-initial-stud-set/WBRUE777.html,http://fxo.co/4msB,18,44,false,true,40a7e7c0-536b-428f-b7c5-5a288ef3ae17.png,70251263-668b-44f5-85be-9994c31d1ade.jpg,48,48
641,Bright Ideas Drop Earrings,87,32,These earrings will make her feel vintage with a pendent that glitters against a shiny hoop,"These earrings will make her feel vintage with a pendent that glitters against a shiny hoop
",https://shop.nordstrom.com/s/kate-spade-new-york-bright-idea-drop-earrings/4644053,http://fxo.co/5gi0,18,100,false,true,933b2336-a4c6-4f02-a9ca-27cd22fbcda3.png,c135033a-186d-45e7-b829-86c3d91ff92d.jpg,48,48
642,Sailor's Knot Hinge Bangle,87,65,"Whether it's worn alone or with a stack of other bangles, this bracelet will put a sweet, seaside twist on her outfits","Whether it's worn alone or with a stack of other bangles, this bracelet will put a sweet, seaside twist on her outfits. Multiple color options available.",https://www.katespade.com/products/sailor%27s-knot-hinge-bangle/WBRU4154.html,http://fxo.co/4msD,18,54,false,true,9bcf3887-2e9a-49d2-b655-a90650cf49b4.png,79f260cd-2cbf-4151-9431-8edee4a7ad57.jpg,78,78
643,Initial Heart Line Bracelet,87,65,This bracelet can be engraved with her initials or even a favorite short phrase for both a classic and unique look,This bracelet can be engraved with her initials or even a favorite short phrase for both a classic and unique look,https://www.katespade.com/products/demi-fine-heart-line-bracelet/WBRUE179.html,http://fxo.co/4msE,11,100,false,true,7ea1b86d-feb0-4a27-acfc-445cef2b2b8c.png,2a1ea4cd-3436-4dc0-9451-2f723c905209.jpg,128,128
644,Initial Heart Ring,87,65,"This ring can be customized by engraving with her initials, those of her sweetheart, or even a favorite short phrase","This ring can be customized by engraving with her initials, those of her sweetheart, or even a favorite short phrase",https://www.katespade.com/products/demi-fine-heart-signet-ring/WBRUE1843.html,http://fxo.co/4msF,16,100,false,true,0e8aaabd-a21f-463b-a361-f483fd7dc5d3.png,c07540cc-3e44-4281-9da0-99b10e0c41e0.jpg,118,118
645,Initial Pendant,87,65,"This rose gold plated, custom initial pendant is a beautiful reminder of who she is","This rose gold plated, custom initial pendant is a beautiful reminder of who she is",https://www.katespade.com/products/initial-pendant/WBRUE848.html,http://fxo.co/4msG,11,100,false,true,5cb33462-95a9-4c1f-b08a-74d53b43ed17.png,5d3c0241-a91d-4c8a-8d6a-828852d4cfb5.jpg,58,58
