id,name,brand_id,retailer_id,feature_description,detailed_description,product_link,affiliate_link,min_age,max_age,male,female,picture,detail_picture,min_price,max_price
300,Flower Stud Earrings,184,1,Simple and sweet can make a big statement with these earrings by Marc Jacobs,Simple and sweet can make a big statement with these daisy stud earrings by Marc Jacobs. ,https://www.amazon.com/dp/B01NBWZMSZ/?tag=outgift00-20,https://www.amazon.com/dp/B01NBWZMSZ/?tag=outgift00-20,15,24,false,true,300c2827-21ee-4657-bbf7-dc0f4116045c.png,6b6d5424-4e54-459d-b32c-0941467f3d13.png,36,36
302,Hoverboard,301,1,This electrical self-balancing board will keep them on their toes,"This electrical self-balancing board will keep them on their toes.  It features a LED battery indicator, non-slip food pedals and solid rubber tires for all- terrain purposes. Comes with a 1-year warranty and is available in multiple colors.",https://www.amazon.com/dp/B01N8TPFJB/?tag=outgift00-20,https://www.amazon.com/dp/B01N8TPFJB/?tag=outgift00-20,11,17,true,true,1681cb41-a4d0-4592-8727-54f55d199ad1.jpg,86fe649f-cf70-478d-9137-b0af635ba0e3.jpg,330,330
303,Atlas Pasta Maker,353,1,"This stainless steel pasta-maker is made in Italy and can make lasagne, fettuccine, and tagliolini","This stainless steel pasta-maker is made in Italy and can make lasagne, fettuccine, and tagliolini. It includes a pasta cutter, hand crank, clamp and a 10-year warranty.",https://www.amazon.com/dp/B0009U5OSO/?tag=outgift00-20,https://www.amazon.com/dp/B0009U5OSO/?tag=outgift00-20,25,100,true,true,8eba457f-4196-4ce5-942a-1cf0ad542abe.png,1e250cc3-12e0-4860-be09-08fc526a059b.jpg,69,70
304,All Seasons Doll House,344,1,This timeless and classically designed doll house has the option to come fully furnished,This timeless and classically designed doll house has the option to come fully furnished. ,https://www.amazon.com/dp/B005QZLBXO/?tag=outgift00-20,https://www.amazon.com/dp/B005QZLBXO/?tag=outgift00-20,3,8,true,true,e3be20d9-c2e4-4460-90c0-6c4574b5e8d4.png,6dc54e76-e98b-4edc-af6b-13fa2587ec15.jpg,100,110
305,Video WalkieTalkies,189,1,Equip them with a 2-way video WalkieTalkie so they can stay in communication with their fellow agents,Encourage their imagination by equipping them with 2-way audio/video communications. With a range of up to 160 feet they can stay in constant communication with their fellow agent.,https://www.amazon.com/dp/B00CNNPPVG/?tag=outgift00-20,https://www.amazon.com/dp/B00CNNPPVG/?tag=outgift00-20,5,10,true,false,f783f57b-349d-438d-869b-b88a0ed0542c.png,a0cd1d14-4d26-4e74-b0dc-4f5e93b09e17.jpg,30,30
307,Baseball Game ,190,1,Perfect for die-hard fans or kids just learning the game,"Perfect for die-hard fans or kids just learning the game, this game has realistic baseball action and simulates a real game! Encourages hand-eye coordination and interaction.",https://www.amazon.com/dp/B00704INPS/?tag=outgift00-20,https://www.amazon.com/dp/B00704INPS/?tag=outgift00-20,5,10,true,false,93431716-94c2-479f-90b9-6af8b0ad0e9b.png,a3c96951-b0f1-419d-b82a-90835da3d404.jpg,39,39
308,Plush Pusheen,191,1,"Get them this adorable chubby gray tabby cat that loves cuddles, snacks, and dress-up","Get them this adorable chubby gray tabby cat that loves cuddles, snacks, and dress-up.  You can get her holding one of her (or your) favorite snacks: a donut, cookie, cupcake or ice cream!",https://www.amazon.com/dp/B00SC4DD64/?tag=outgift00-20,https://www.amazon.com/dp/B00SC4DD64/?tag=outgift00-20,0,10,true,true,8f270b27-6e6b-4b74-a4cf-938c70964b6f.png,52de0721-ef11-4167-bfa3-8dd9e17ccddc.jpg,15,20
309,Laugh & Learn Greetings Globe,192,1,"Set them up for a life-long love of traveling with this interactive globe that helps teach global greetings, animals and more","Set them up for a life-long love of traveling with this Interactive globe helps teach global greetings and more. With a spin, a press or a flip, toddlers will learn all about animals, music and greetings from all over the world through sounds, songs, tunes and phrases.",https://www.amazon.com/dp/B01ASVCW6K/?tag=outgift00-20,https://www.amazon.com/dp/B01ASVCW6K/?tag=outgift00-20,1,3,true,true,243d44f0-a9f2-4e25-9b22-fc58f2788121.png,e1c6e18f-1fb7-4242-b571-37dbaaa35d32.jpg,30,35
310,Big Red Classic Wagon,193,18,This big red classic wagon should be a part of everyone's childhood,"This big red classic wagon should be a part of everyone's childhood. This wagon features an all-steel seamless body with no-scratch edges, an extra-long handle that folds under for easy storage, and a controlled turning radius to prevent tipping.",http://www.target.com/p/radio-flyer-classic-red-wagon/-/A-681721?ref=tgt_adv_XS000000&AFID=google_pla_df&CPNG=PLA_Sports+Shopping&adgroup=Wagon_SC&LID=700000001170770pgs&network=g&device=c&location=9003562&gclid=CjwKEAiAlNbEBRCv9uy4j4SWrgwSJAB5MqJFhPiWbWfvBFm1FQlv5Mc03DorOHJY4Q09__Reu9X87RoC45Xw_wcB&gclsrc=aw.ds,http://fxo.co/4nGe,2,10,true,true,e653b835-70ab-404d-ac45-2fc873ceb218.png,0f5b6c23-16b3-4e0e-95eb-70d56e75323a.jpg,82,100
311,Harry Potter Trivial Pursuit,194,1,Challenge the Harry Potter fan in your life with a game of Trivial Pursuit,"Challenge the Harry Potter fan in your life with a game of Trivial Pursuit. This quick-play Trivial Pursuit game can be played on-the-go with its portable wedge holder. The 600 questions range in difficulty levels, so even the expert wizards will be challenged!",https://www.amazon.com/dp/B00TTX54GO/?tag=outgift00-20,https://www.amazon.com/dp/B00TTX54GO/?tag=outgift00-20,5,10,true,true,78e796ba-2fa8-4f37-b7f0-bc573c953959.png,73c06c35-7a24-4970-b47d-2933d5205081.png,10,15
312,Monogram Shelby Cobra Model,195,1,This plastic car model is challenging and fun for the little builder in your life,"This plastic car model is challenging and fun for the little builder in your life. It features highly detailed plastic pieces along with chrome plated parts and soft black tires, opening hood with fully detailed 427 cubic inch engine offer a realistic replication to any car fan",https://www.amazon.com/dp/B0083VDTKG/?tag=outgift00-20,https://www.amazon.com/dp/B0083VDTKG/?tag=outgift00-20,11,17,true,false,190c4c3b-9396-4d56-8dd7-dd46442e8099.png,55200ef1-ce4c-4a06-a750-3a518ea2c5f7.jpg,30,37
313,miniMaker 3D Printer,196,1,"The da Vinci miniMaker is the perfect, lightweight desktop 3D printer for beginners",The da Vinci miniMaker is the perfect desktop 3D printer for beginners. Its lightweight and compact design fits easily in tight places.  A great educational tool!,https://www.amazon.com/dp/B01EWGJAS0/?tag=outgift00-20,https://www.amazon.com/dp/B01EWGJAS0/?tag=outgift00-20,14,17,true,true,bc0e8536-f2e6-4ee0-8206-6988308d9ac8.png,fa8a5499-8561-48a2-be7a-784b5cedee05.jpg,180,200
314,Grill Planks,73,40,"Sweet, savory, nutty, smoky—all are possible with this sampler pack of beautifully cut planks","Sweet, savory, nutty, smoky—all are possible with this sampler pack of beautifully cut planks. They can work their way up from the subtle smokiness of alder to the bold flavor of hickory, or alternate the spice of red cedar with the sweetness of maple and cherry. ",https://food52.com/shop/products/2232-grill-planks-sampler-pack-set-of-5,http://www.anrdoezrs.net/click-8068766-12380826?url=https%3A%2F%2Ffood52.com%2Fshop%2Fproducts%2F2232-grill-planks-sampler-pack-set-of-5%3Fsku%3D11x5&cjsku=2232_11x5,21,100,true,true,42a2f56d-1e3f-4d35-ac4d-ebd7934dbf5b.png,d3e38d93-e056-401e-b1e7-ebb6b28fde0d.jpg,20,30
315,Classic Vacuum Insulated Growler,197,1,This vacuum insulated beer growler keeps beer cold for up to 24 hours for the outdoors lover in your life,"This vacuum insulated beer growler keeps beer cold for up to 24 hours for the outdoors lover in your life.  It's made of 18/8 stainless steel so it won't rust, and it's naturally BPA-free.",https://www.amazon.com/dp/B0194LV1JO/?tag=outgift00-20,https://www.amazon.com/dp/B0194LV1JO/?tag=outgift00-20,21,100,true,false,2410dfa9-6c86-4670-a15f-bea3ab76c669.png,27ef6755-0907-4f64-868d-199d93569c19.jpg,35,40
316,Scrabble Linen Vintage Book Edition,198,1,"This scrabble linen vintage bookshelf edition is the perfect combination of form, function and fun","This scrabble linen vintage bookshelf edition is the perfect combination of form, function and fun! The stylish linen-wrapped book will look absolutely beautiful displayed on their bookshelf.",https://www.amazon.com/dp/B01CPUSHSO/?tag=outgift00-20,https://www.amazon.com/dp/B01CPUSHSO/?tag=outgift00-20,11,100,true,true,f8d1ac52-8a10-493c-9bfa-b790e4a60b8d.png,5c541558-a675-4d84-9112-f907ed28a911.jpg,25,30
318,Big Color America Poster,199,1,This fun giant coloring poster of America filled with fun facts will keep them busy for hours,"Fun and educational, each state has retro drawings that relate to a fun fact or trivia relevant to that state. Spread it on the floor, down the length of a table or hang it on the wall (Great for a party project!)",https://www.amazon.com/dp/B01CR98TJA/?tag=outgift00-20,https://www.amazon.com/dp/B01CR98TJA/?tag=outgift00-20,3,10,true,true,eef96410-eb93-4f34-ae18-519abab2fcf2.png,559b1a16-edb8-4788-a6eb-2ab003a3e327.jpg,40,40
319,Rainforest Jumperoo,192,1,The Rainforest Jumperoo is a safe and comfortable place for baby to sit and play,The Rainforest Jumperoo is a safe and comfortable place for baby to sit and play. Two soft leaves extend from the frame to create an overhead canopy with soft toys that dangle down for fun bat-at play. ,https://www.amazon.com/dp/B000LXQVA4/?tag=outgift00-20,https://www.amazon.com/dp/B000LXQVA4/?tag=outgift00-20,0,1,true,true,18527f95-2018-4a76-b3a9-9ac06876222d.png,a3eb09c5-d256-4ee1-832d-e67828f0143d.jpg,90,105
320,Snugapuppy Sleeper,192,1,"Designed with restful nights in mind, this sleeper has a comfortable incline for any little one","Designed with restful nights in mind, this sleeper has a comfortable incline for any little one! Deluxe, cuddly fabrics, mesh sides and an ultra-plush puppy head rest and insert are just what baby needs to feel relaxed and secure.",https://www.amazon.com/dp/B00DEI6MMU/?tag=outgift00-20,https://www.amazon.com/dp/B00DEI6MMU/?tag=outgift00-20,0,1,true,true,4a273d5b-cd09-4d4c-82d9-7011d6065ed8.png,eb4e7331-c0a9-4315-9407-c721787004fb.jpg,60,60
321,Travel Sleep Sheep,147,1,This adorable travel companion brings its comforting sleep time sounds to any little one,This adorable travel companion brings its comforting sleep time sounds to any little one when they're away from home.,https://www.amazon.com/dp/B000J6CDY6/?tag=outgift00-20,https://www.amazon.com/dp/B000J6CDY6/?tag=outgift00-20,0,4,true,true,7a908ff2-7815-44a6-8613-d71ac9298a83.png,948cd138-648c-4ff6-8237-c7c657e2367b.jpg,30,30
322,Baby Monitor,201,1,This first-ever baby monitor with interchangeable optical lens capability is highly rated,This first-ever baby monitor with interchangeable optical lens capability is highly rated. They can customize the viewing angle and zoom to keep peace of mind at night.,https://www.amazon.com/dp/B00ECHYTBI/?tag=outgift00-20,https://www.amazon.com/dp/B00ECHYTBI/?tag=outgift00-20,18,50,true,true,a776bce7-e100-4334-99b9-81470a39d6de.png,cf23b9e9-ddcd-4e34-a5e5-15e8dcde7129.jpg,165,170
323,VISTA Stroller,202,1,This sturdy and beautifully designed stroller is perfect for a growing family,"This sturdy and beautifully designed stroller is perfect for a growing family. The VISTA's intuitive design allows for multiple configurations, making transporting even a second and third child a breeze.",https://www.amazon.com/dp/B013CTH8NC/?tag=outgift00-20,https://www.amazon.com/dp/B013CTH8NC/?tag=outgift00-20,18,50,true,true,a7aeaaec-901f-4ab2-9e19-d3df402bae95.png,9aef452e-b43b-4058-901b-5dd9215293fc.jpg,659,840
324,Tripp Trapp Highchair,203,1,Theis beautifully designed Tripp Trapp highchair adapts to a child as they grow,Theis beautifully designed Tripp Trapp highchair adapts to a child as they grow and looks great at any dining table,https://www.amazon.com/dp/B017L0X2WO/?tag=outgift00-20,https://www.amazon.com/dp/B017L0X2WO/?tag=outgift00-20,18,50,true,true,b8fe7be0-d1c0-4bbe-ac8e-913e8eb2036b.png,7b847234-c731-4628-8d86-feab3d38964b.jpg,249,249
326,Food Maps,205,76,Hot off the presses: Explore your favorite city according to your favorite food,"All-You-Can-Eat Press is a Brooklyn-based independent publishing company that celebrates everyday food for everyday people. United by a mutual love for vernacular cuisine and the unique flavor of the surrounding local culture, its founders follow their hearts (and stomachs) to find new favorite dishes, restaurants and specialty shops, then serve them up in brightly wrapped, easily-digestible portions to food lovers everywhere.",http://www.allyoucaneatpress.com/shop/,http://bit.ly/2ruwiKv,18,100,true,true,cbb4cf29-4163-41c5-aa80-6e48729d5fc1.png,db096bf5-6edc-4d40-a9e6-dfbdad651583.jpg,8,8
327,Stackable Initial Rings,206,42,These gold stackable rings feature a custom letter to let her know she's one of a kind,"These gold stackable rings feature a custom letter to let her know she's one of a kind. Made of 18-karat gold plated vermeil, its slim bands mean they look great stacked!",http://www.neimanmarcus.com/Sarah-Chloe-Gold-Stackable-Initial-Ring-Sarah-Chloe/prod162060070_cat48550735__/p.prod?icid=&searchType=EndecaDrivenCat&rte=%252Fcategory,http://bit.ly/2F2wCSB,15,100,false,true,04358376-942b-49b1-8517-b22128704135.png,9bdf35f5-a06e-4b7c-82a3-ae634e7ff25d.jpg,69,69
330,Love Knot Ring,360,79,The love knot ring is an elegant reminder for anyone you hold dear,"The love knot ring is an elegant reminder for anyone you hold dear. Hand-crafted from a single band of 14k yellow gold, 14k rose gold or sterling silver.",https://www.arielgordonjewelry.com/collections/rings/products/love-knot-ring,http://bit.ly/2G7yo6y,16,100,false,true,2679d36c-2ece-4819-b11d-8516ebc5cb51.png,6d81f034-47b1-47bb-aa52-a2faa16137f0.jpg,220,220
331,Hardcover Photo Book,210,80,Just add photos to this beautiful hardcover photo book to make a personalized gift they can keep forever,Just add photos to this beautiful hardcover photo book to make a personalized gift they can keep forever. It features 100% recycled interior pages and editorial cover designs.,http://shrsl.com/?gl20,http://shrsl.com/?gl20,25,100,true,true,1aec57c0-425c-4da2-942a-1c37ae907db1.png,d38fdb45-6746-4ae9-aad1-4052d971d899.jpg,69,89
333,Stuffed Animal,211,1,These cute plush animals from Bellzi are bound to be their new favorite teddy,These cute plush animals from Bellzi are bound to be their new favorite teddy.  Multiple animals and colors available from Bellzi.,https://www.amazon.com/dp/B00P5P6N10/?tag=outgift00-20,https://www.amazon.com/dp/B00P5P6N10/?tag=outgift00-20,0,4,true,true,64b84fc4-258c-472a-9dd1-7ced4df8e62a.png,d31a0def-4c1e-4314-9f28-60248443db53.jpg,15,20
334,Chocolate Makin' Kit,212,1,Contains everything they'll need to get started making chocolate,Contains everything they'll need to get started making chocolate (about 60 pieces). Includes a reusable silicone chocolate mold and ingredients are organic and naturally sweetened with wild California honey.,https://www.amazon.com/dp/B01B44R2DI/?tag=outgift00-20,https://www.amazon.com/dp/B01B44R2DI/?tag=outgift00-20,18,100,true,true,3b7eb976-9c2f-4c6a-9e99-6502857bf682.png,90768c9c-8bb7-4d79-8055-b433a735dfe1.jpg,79,79
335,Beauty Subscription,213,81,"Gift her a subscription of personalized, best selling beauty products from high-end brands","Gift her a subscription of personalized, best selling beauty products from high-end brands",https://www.birchbox.com/gift,http://fxo.co/4ys2,19,50,false,true,5b26b352-a191-4a0e-8681-ede731e32e83.png,7ee35289-c5c0-4e5a-979a-48b1ad2363a3.jpg,30,30
337,Boys' Pajamas,215,82,These cotton pajamas are supersoft and cozy ,These cotton pajamas are supersoft and cozy.,https://www.jcrew.com/c/boys_category/pajamas,https://redirect.viglink.com?key=561d129541fdeb0c8f096304b858bca5&u=https%3A%2F%2Fwww.jcrew.com%2Fc%2Fboys_category%2Fpajamas,4,11,true,false,27e225b6-705b-4755-a2e7-f8edcd758dc2.png,f8bd232b-7516-48bb-bb85-ac95ba9663d8.jpeg,20,30
338,Pick 3 Travel Candles,216,83,These luxe brushed gold travel-friendly candles are perfect for the office or jetsetting around the globe,"These luxe brushed gold travel-friendly candles are perfect for the office or jetsetting around the globe. Made in Brooklyn, New York with 100% soy derived from American-grown soy beans for an eco-friendly, clean burn these candles use a lead-free cotton wick primed with vegetable based wax and premium grade fragrance oil with no added dyes or chemicals.",https://brooklyncandlestudio.com/collections/gift-sets/products/forest-candle-set,https://brooklyncandlestudio.com/collections/mini-candle-tins/products/forest-candle-set?rfsn=1046795.a9b201a&utm_source=refersion&utm_medium=affiliate&utm_campaign=1046795.a9b201a,21,100,false,true,929a8867-5307-4edf-83a3-b35083ebfc53.png,26623eb3-cc63-46c6-8e8a-670873aea259.jpg,40,40
340,Classic Lit for Babies,218,1,A great way to introduce toddlers to the world of classic literature,"A great way to introduce toddlers to the world of classic literature.  Titles to choose from include Little Women, The Adventures of Huckleberry Finn and more",https://www.amazon.com/dp/1423643895/?tag=outgift00-20&th=1,https://www.amazon.com/dp/1423643895/?tag=outgift00-20&th=1,2,4,true,true,e024be98-861e-4cf2-a916-ac4fe36799f1.png,81d7f1cf-3a59-4290-ba9f-23bde77fc808.jpg,7,10
341,Cozmo Robot,219,1,Cozmo is a real-life game playing robot with emotions and a one-of-a-kind personality ,Cozmo is a real-life game playing robot with emotions and a one-of-a-kind personality that evolves the more you hang out.,https://www.amazon.com/dp/B01GA1298S/?tag=outgift00-20,https://www.amazon.com/dp/B01GA1298S/?tag=outgift00-20,8,17,true,false,8cd9afd2-c496-4367-8ecd-5c328cf5403c.png,4bbe4a44-c0bc-4d8b-a54b-a69abbe5509d.jpg,170,180
343,Design Your Own Superhero Mask,221,1,Turn every day into an awesome fun adventure with this DIY superhero mask kit,"Turn every day into an awesome fun adventure with this DIY superhero mask kit.  Kit includes: felt mask, felt shapes, felt sheets, glitter glue and craft glue",https://www.amazon.com/dp/B017O3X9JO/?tag=outgift00-20,https://www.amazon.com/dp/B017O3X9JO/?tag=outgift00-20,3,8,true,true,c55b15c4-41d7-473a-b021-0d5feee533a0.png,69194bf0-ea74-4eb7-8df8-72e5cb260c2a.jpg,20,20
344,DIY Pinball Machine,15,86,"Let them design the board, launch, and play, all while discovering pinball game physics","Let them design the board, launch, and play, all while discovering pinball game physics.",http://www.kiwicrate.com/pinball.html?utm_term=wJEV%3AxVRJyLdXILQP92yXQdzUkhx3sWlo2SCR40&utm_campaign=10079&utm_medium=AFF&utm_source=Ignite,http://redirect.viglink.com?key=561d129541fdeb0c8f096304b858bca5&u=http%3A%2F%2Fwww.kiwicrate.com%2Fpinball.html%3Futm_term%3DwJEV%253AxVRJyLdXILQP92yXQdzUkhx3sWlo2SCR40%26utm_campaign%3D10079%26utm_medium%3DAFF%26utm_source%3DIgnite,5,8,true,true,b1b133a0-a84a-4868-9a95-0e01981c2c3c.png,98848467-cf5b-4216-b97f-50062d25dfd5.jpg,20,20
345,Gisele Pajama Set,559,17,She'll feel classy and comfortable while lounging around the house in this elegant sleepwear set,"She'll feel classy and comfortable while lounging around the house in this elegant sleepwear set.  Features a notch collar, button front closure, long sleeves, front patch pocket and contrast piping. Multiple colors available.",http://www1.bloomingdales.com/shop/product/eberjey-gisele-long-sleeve-short-pajama-set?ID=1778730&CategoryID=1005101#fn=spp%3D7,http://fxo.co/4muQ,18,45,false,true,93cd5ff2-9f7e-40f1-b463-f2ef0bea7dea.png,6030b0f8-fbd7-4eed-9245-d1d3701d8779.jpeg,115,115
347,Bronte Heart Necklace,224,17,This elegant drop pendant is sure to make her heart race,This elegant drop pendant by Elizabeth and James is sure to make her heart race.Features a lobster clasp closure and 24K gold-plated silver.,http://www1.bloomingdales.com/shop/product/elizabeth-james-bronte-heart-pendant-y-necklace-16?ID=1817593&CategoryID=1005786&LinkType=#fn%3Dspp%3D1,http://fxo.co/4muL,18,30,false,true,a7523ac1-a12f-424a-9ce4-9c393d0df551.png,6ba6153d-3d4f-470d-98a8-58d3af489c7a.jpeg,125,125
348,Photo Scanning System,126,1,This photo scanner scans thousands of photos as fast as one photo per second,This photo scanner scans thousands of photos as fast as one photo per second in high quality.,https://www.amazon.com/dp/B01HR89FNK/?tag=outgift00-20,https://www.amazon.com/dp/B01HR89FNK/?tag=outgift00-20,45,100,true,true,5aad9083-dadb-4fcd-8ff3-42b45380dd82.png,0759dab5-9c94-4036-8b70-6634f09e8a7d.png,600,600
349,Girls' Pajamas,215,82,"These supersoft and cozy pajamas are anything but a snoozefest—especially when they're covered in a friendly monster), Max!","These supersoft and cozy pajamas are anything but a snoozefest—especially when they're covered in a friendly monster), Max!
",https://www.jcrew.com/c/girls_category/pajamas,https://redirect.viglink.com?key=561d129541fdeb0c8f096304b858bca5&u=https%3A%2F%2Fwww.jcrew.com%2Fc%2Fgirls_category%2Fpajamas,2,10,false,true,bfee131f-2c60-48bd-a57e-0222e4b4bdd5.png,045ae616-9ed7-4910-b392-12a541de7925.JPG,25,30
351,How to Travel the World on $50 a Day,356,1,A must have for the budget conscious traveler,"A must have for the budget conscious traveler, this book shows you how to have a great experience traveling without spending tons of money",https://www.amazon.com/dp/0399173285/?tag=outgift00-20,https://www.amazon.com/dp/0399173285/?tag=outgift00-20,18,100,true,true,1e060e24-827a-44fb-8b43-6665404a7d20.png,8aa10c62-96c5-4d2d-8c5f-700ceb0453c2.jpg,10,12
353,Red Roses Body Wash,226,17,"Instead of giving her flowers, give her this Jo Malone body wash with a scent that unfolds like a bouquet of roses","Instead of giving her flowers, give her this Jo Malone body wash with a scent that unfolds like a bouquet of roses.",http://www1.bloomingdales.com/shop/product/jo-malone-london-red-roses-body-hand-wash?ID=584117,http://fxo.co/4muY,25,100,false,true,fdf583ac-f339-4e99-831c-687a2090f732.png,a9b81f32-fb8e-4e13-a22f-332699fe275b.jpeg,40,40
354,Garden Drive Square Jewelry Box,87,65,This shiny lacquer box from kate spade new york keeps jewelry stylishly tucked away,This shiny lacquer box from kate spade new york keeps jewelry stylishly tucked away.  Multiple color options available. ,http://fxo.co/4mrm,http://fxo.co/4mrm,15,100,false,true,a2c9d239-d084-48fe-bb17-186fac2fa535.png,7d18bac6-63d8-48ef-a972-ce6921eab7b9.png,40,40
355,Kids Yoga Cards Kit,227,1,"Get your kids moving, concentrating and relaxing in a fun and playful way","Get your kids moving, concentrating and relaxing in a fun and playful way. Includes 20 artistic illustrations, 20 poems (40 cards), 2 super fun dice and a leaflet with 4 games.",https://www.amazon.com/dp/B01K9WEM2A/?tag=outgift00-20,https://www.amazon.com/dp/B01K9WEM2A/?tag=outgift00-20,3,12,true,true,3afc1517-23af-4190-9de2-8ba3092ec887.png,1e0adecd-6d01-497f-b505-6858dae5642f.jpg,15,20
356,Smart Stick Digital Thermometer,228,1,This digital thermometer tracks the health history of each family member,"This digital thermometer tracks the health history of each family member. The free app records fevers, symptoms, medication dosages, and other important health data in a time-stamped log. Great for new moms.",https://www.amazon.com/dp/B00UFOBDNY/?tag=outgift00-20,https://www.amazon.com/dp/B00UFOBDNY/?tag=outgift00-20,18,50,true,true,4ce95dbc-9dc9-4d9a-b9e2-39b9234ec0f4.png,95f31051-42df-48de-b357-aadcdb8d76d0.jpg,15,15
358,Slim Reusable Water Bottle,229,1,"This flat, reusable water bottle from Memobottle is minimalist in design and ideal for the conscious traveler in your life","This flat, reusable water bottle from Memobottle is minimalist in design and ideal for the conscious traveler in your life.  It's durable, leak proof, freezer proof, made from recycled plastic and can stand up unassisted. ",https://www.amazon.com/dp/B011Q2UF4G/?tag=outgift00-20,https://www.amazon.com/dp/B011Q2UF4G/?tag=outgift00-20,19,100,true,true,3cdb57cc-e192-4675-92bc-c1269809d7ae.png,30311018-c77c-4715-b915-e97de764bb44.jpg,28,36
360,Mini Instagram Projector,230,1,Create a custom tiny Instagram projector with their favorite images,Create a custom tiny Instagram projector with their favorite images.  This little bit of nostalgia is small enough to fit into the palm of your hand. ,http://amzn.to/2Dxxim3,http://amzn.to/2Dxxim3,14,17,true,true,53da1488-b151-4565-b57c-2e48833a2892.png,e280cd51-8ef6-4eeb-8dd9-b626abfcea30.jpg,40,40
361,Smartphone Multitool Case,232,1,This impact-resistant case protects their phone and keeps all their tools readily available,"This impact-resistant case protects their phone and keeps all their tools readily available.  It includes: #1 flathead screwdriver, #2 flathead screwdriver, #1 Phillips screwdriver, #2 Phillips screwdriver, spring-action scissors, nail file, nail cleaner, cuticle tool, bottle opener, tweezers, writing pen, and toothpick.",http://amzn.to/2Ix9nTa,http://amzn.to/2Ix9nTa,18,100,true,false,937ce0f4-b271-4945-8f8c-1035bc2df8c5.png,b8b350b8-a2f8-4211-9bff-dffd3c4187e6.jpg,10,15
362,Imperial Rose Champagne,359,89,Celebrate by popping a bottle of Brut Impèrial Rosè ,Celebrate by popping a bottle of Brut Impèrial Rosè with shades of copper,https://drizly.com/moet-and-chandon-imperial-rose-champagne/p1681,http://fxo.co/572I,21,100,false,true,8b0de821-211d-4691-91b7-ec54066b2593.png,bce0fc7f-a82c-4622-a6a9-45a39aadace4.jpg,40,100
