id,name,brand_id,retailer_id,feature_description,detailed_description,product_link,affiliate_link,min_age,max_age,male,female,picture,detail_picture,min_price,max_price
2,Smart Athletic Gear,2,2,Athos smart workout apparel provides real-time insight into your heart rate and how hard your muscles are working,"With built-in sensors, Athos smart workout apparel provides real-time insight into your heart rate and how hard your muscles are working. It also features high-performance compression materials that reduce muscle fatigue.",https://www.liveathos.com/collections/starter-kits/products/mens-upper-body-kit,https://www.liveathos.com/collections/starter-kits/products/mens-upper-body-kit,22,54,true,false,d5853f1d-eb00-4a74-9f55-ae60367baf0d.png,3d08d281-ea6c-412b-83cf-aec25d9e3dd6.jpg,398,398
5,Leather Charging Wallet,4,3,This expertly crafted slim leather wallet has a built in battery and charging cable,"This expertly crafted slim leather wallet has a built in battery and charging cable. It's made from 100% American leather supplied by the renowned Horween Leather Company of Chicago, Illinois.",https://www.hellonomad.com/leather-charging-wallet-slim,http://fxo.co/4nH8,21,100,true,false,f19e13e6-cf59-4d07-87f2-c1df4c5e4dab.png,4ac8a3f7-98b6-4891-ba75-b5b2f65aa1ae.jpg,80,80
9,QuietComfort Wireless Headphones,8,1,"These highly rated speakers provide deep, powerful sound and significant noise reduction for the music lover","These highly rated speakers provide deep, powerful sound and significant noise reduction for the music lover. The lightweight, comfortable around-ear fit means they can wear them all day long.",http://www.amazon.com/dp/B0756CYWWD/?tag=outgift00-20,http://www.amazon.com/dp/B0756CYWWD/?tag=outgift00-20,16,100,true,true,9c1c2b36-d171-45bd-87bf-97a6ce0f071e.png,520705ba-3736-48e4-b40f-3e2abcf34a3c.jpg,349,349
10,X-T10 Silver Mirrorless Digital Camera Kit,9,1,Help them capture special moments with this highly rated digital camera,"Help them capture special moments with this highly rated digital camera. It's small, lightweight and very capable, making it an ideal companion for everyday photography and traveling.",http://www.amazon.com/dp/B00X7QTVSQ/?tag=outgift00-20,http://www.amazon.com/dp/B00X7QTVSQ/?tag=outgift00-20,21,100,true,true,433e5c51-9fe6-4e45-8883-b277a3041a73.png,cce8fc23-e453-4d00-8193-37700b2f382d.jpg,800,900
15,Star Wars Eclipse Fighter,10,5,This Lego set will let them discover Naare’s transforming Eclipse Fighter from the Star Wars movie,"This Lego set will let them discover Naare’s transforming Eclipse Fighter from the Star Wars Movie. Features a fighter with an opening minifigure cockpit and hidden spring-loaded missiles, plus a speeder and two minifigures.",http://www.amazon.com/dp/B01CIGN2U8/?tag=outgift00-20,http://www.amazon.com/dp/B01CIGN2U8/?tag=outgift00-20,5,10,true,true,49cb7822-b829-40e2-8645-50cff3146f3f.png,bf2f84b1-8a41-422c-84c6-60f28b9d5723.png,44,50
16,Starwars Snowspeeder,10,5,Hop on the Starwars fan bus with this LEGO set,"Hop on the Starwars fan bus with this LEGO set. Comes with the Snowspeeder, blasters and three minifigures.",http://www.amazon.com/dp/B00WI0SS7M/?tag=outgift00-20,http://www.amazon.com/dp/B00WI0SS7M/?tag=outgift00-20,5,10,true,true,feb4515a-88bf-492d-8b13-2a23ab905d58.png,4a88ae96-631e-4236-8984-e27417f46b17.jpg,50,55
17,Selphy Portable Photo Printer,11,1,This highly rated compact printer wirelessly connects to your smart device to print borderless photos,"This highly rated, lightweight and compact printer wirelessly connects to your smart device to print borderless, high quality 4x6 photos.",http://www.amazon.com/dp/B00HK8V4NC/?tag=outgift00-20,http://www.amazon.com/dp/B00HK8V4NC/?tag=outgift00-20,21,100,true,true,0fd765eb-bf5f-4838-9b75-2e297c1f155a.png,2fdeb260-dc17-4668-8225-bcaa9ea13e1e.jpg,100,160
18,Men's Sunglasses,12,6,"Warby Parker sunglasses offer durability, anti-scratch coating and are made with polarized polycarbonate lenses","Warby Parker sunglasses offer durability, anti-scratch coating and are made with polarized polycarbonate lenses, the most impact-resistant prescription lens material on the market.",http://shrsl.com/injf,http://shrsl.com/injf,18,100,true,false,992a942b-4780-4e3c-bf35-237ff3733dbe.png,5e17031b-838f-410e-bf0b-3c96418d516b.jpg,95,95
19,Women's Sunglasses,12,6,"Warby Parker sunglasses offer durability, anti-scratch coating and are made with polarized polycarbonate lenses","Warby Parker sunglasses offer durability, anti-scratch coating and are made with polarized polycarbonate lenses, the most impact-resistant prescription lens material on the market.",http://shrsl.com/injg,http://shrsl.com/injg,18,100,false,true,28038d1e-ce38-4675-84cc-7b627749e253.png,542d77c8-8608-4ff1-9a48-1b4218f45cd7.jpg,95,95
20,Ruby’s Sky High Cable Car,541,1,Award-winning construction toys that encourage girls to solve real-world problems by building simple machines,"Award-winning construction toys that encourage girls to solve real-world problems by building simple machines. As kids read along, they can build what Goldie builds using the included tool kits. Multiple kits available.",http://www.amazon.com/dp/B016YTMJOA/?tag=outgift00-20,http://www.amazon.com/dp/B016YTMJOA/?tag=outgift00-20,4,10,false,true,b03d2a1a-e0ef-4390-933f-3fd4be3076a2.png,32dbce82-50cf-4a8f-9f94-c16509ea5f86.jpg,24,24
21,Puzzlets,14,1,"Plan, program, and play with this exciting new game that helps kids think like a programmer while having fun","Plan, program, and play with this exciting new game that helps kids think like a programmer while having fun. Features 22 Puzzlets, 1 Rechargeable Play Tray, ""Cork the Volcano"" game, USB cable, and 120 puzzling levels.",http://www.amazon.com/dp/B013TSMF9S/?tag=outgift00-20,http://www.amazon.com/dp/B013TSMF9S/?tag=outgift00-20,6,10,true,true,3a534669-6a25-4029-bdc0-e3e554a584b5.png,7df3c898-cb2e-4053-97b8-bbac34a51d9b.jpg,75,100
22,Monthly Discovery Crate,15,7,"Each crate comes with a hands-on project encouraging kids of all ages to explore art, science and engineering","Each crate comes with a hands-on project encouraging kids to explore art, science and engineering. Includes high-quality materials and kid-friendly instructions. Crate options for various age groups available.",https://www.kiwico.com/gifting,https://www.kiwico.com/gifting,3,16,true,true,aace3580-4e5c-4af8-abba-7e9e4bbef0ea.png,258c9f7f-dc56-4856-950d-d546de79234b.jpg,25,60
23,Dash Robotics Kit,16,1,This award-winning robot gives kids the power to learn coding and bring Dash to life through a smartphone,"This award-winning robot gives kids the power to learn coding and create gadgets and games through hundreds of exciting coding adventures, projects and apps featuring tutorials that teach them how to program Dash.",https://www.amazon.com/dp/B00SKURVKY/?tag=outgift00-20&th=1,https://www.amazon.com/dp/B00SKURVKY/?tag=outgift00-20&th=1,8,14,true,true,ecd2133a-b392-48cc-8e68-ba9bcabfe5f2.png,3b647fdb-8bd7-4af9-a4bb-245b697299c5.jpg,150,150
24,Dot Creativity Robotics Kit,16,1,This award-winning robot gives kids the power to learn coding and create gadgets and games,"This award-winning robot gives kids the power to learn coding and create gadgets and games through hundreds of exciting coding adventures, projects and apps featuring tutorials that teach them how to program Dot.",https://www.amazon.com/dp/B074815FSL/?tag=outgift00-20&th=1,https://www.amazon.com/dp/B074815FSL/?tag=outgift00-20,8,17,true,true,56d97fdb-7687-45ea-b722-acf85058d7aa.png,71f94407-9e07-487c-b127-5a46bf734b54.jpg,70,80
25,Pop Phone Retro Handset,17,1,This fun headset plugs directly into a smartphone and reduces the radiation that comes from mobile devices,This fun headset plugs directly into a smartphone and reduces up to 99% of the radiation absorbed compared to a direct use of your mobile phone. Features a one touch button for pick-up/hang-up directly from the handset.,https://www.amazon.com/dp/B00881WLDM?tag=outgift00-20,https://www.amazon.com/dp/B00881WLDM?tag=outgift00-20,12,17,true,true,27344e42-28be-4ddc-866a-d65129e8093a.png,2049d3f0-6a66-4c83-9b05-245afa9a80ee.jpg,10,20
26,Home Wifi System,18,1,eero is a complete home WiFi system that replaces your wireless router and WiFi range extender. No more dead zones,"The fast, reliable WiFi system of the future. Simply download the app and plug an eero directly into your existing cable or DSL modem. The app guides you through a simple setup and lets you manage your network remotely",http://www.amazon.com/dp/B00XEW3YD6/?tag=outgift00-20,http://www.amazon.com/dp/B00XEW3YD6/?tag=outgift00-20,22,64,true,false,74a7e3d3-a90b-49f9-815b-17089c0c5436.png,1e12163f-779d-475f-bd14-b216d745a045.jpg,300,300
28,Smart Writing Set,19,8,Get the hands-on immediacy of putting pen to paper while allowing for all the advantages of digital creativity,Get the hands-on immediacy of putting pen to paper while allowing for all the advantages of digital creativity. The smart pen captures and transfers each pen stroke from page to screen in real time.,https://store.moleskine.com/usa/en-us/moleskine-/smart-writing-set/smart-writing-set/p1014?utm_source=Moleskine_website&utm_medium=button&utm_campaign=smart_writing_set,https://redirect.viglink.com?key=561d129541fdeb0c8f096304b858bca5&u=https%3A%2F%2Fstore.moleskine.com%2Fusa%2Fen-us%2Fmoleskine-%2Fsmart-writing-set%2Fsmart-writing-set%2Fp1014%3Futm_source%3DMoleskine_website%26utm_medium%3Dbutton%26utm_campaign%3Dsmart_writing_set,18,100,true,true,0066b665-7de3-45b7-b862-aa57455c5abc.png,6cea282f-ebe2-4b4b-9654-f02662dc3f43.jpg,199,199
29,Bryant Large Leather Briefcase,20,9,The sleek exterior on this briefcase opens up to spacious compartments that will keep his essentials and technology in check,"The sleek exterior on this briefcase opens up to spacious compartments that will keep his essentials and technology in check, while its pebbled leather craftsmanship will elevate his office look.
",https://redirect.viglink.com?key=561d129541fdeb0c8f096304b858bca5&u=https%3A%2F%2Fwww.michaelkors.com%2Fbryant-large-leather-briefcase%2F_%2FR-US_33F5LYTA3L%3Fcolor%3D0200,https://redirect.viglink.com?key=561d129541fdeb0c8f096304b858bca5&u=https%3A%2F%2Fwww.michaelkors.com%2Fbryant-large-leather-briefcase%2F_%2FR-US_33F5LYTA3L%3Fcolor%3D0200,22,54,true,false,e84e3b77-ff7f-46b3-8ab5-2ff95b0251fa.png,565ee0e5-d4de-4da3-be27-c787de07e8c3.jpg,190,190
30,Onja Stove,21,10,This little cook stove features a collapsible design that allows it to be easily carried to a campsite or picnic,This little cook stove features a collapsible design that allows it to be easily carried to a campsite or picnic. The two burners can reach boiling in about four minutes and the oak lid doubles as a cutting board.,http://www.backcountry.com/primus-onja-stove,http://fxo.co/4ys7,18,100,true,true,7f06cf5a-92be-4e47-9902-6fbb90005bfa.png,f3d1241d-6347-4e08-815d-bcde2894e5a2.jpg,113,113
31,Recycled Rubber Garden Trug,22,11,"This super-sturdy trug made from heavy duty recycled rubber is handy for hauling, storing and pouring","This trug made from heavy duty recycled rubber is washable, bendable and nearly indestructible - making it perfect for mixing soil, harvesting vegetables, carrying tools and supplies, collecting weeds and more.",http://www.gardeners.com/buy/recycled-rubber-garden-trug-black/8593143.html,http://redirect.viglink.com?key=561d129541fdeb0c8f096304b858bca5&u=http%3A%2F%2Fwww.gardeners.com%2Fbuy%2Frecycled-rubber-garden-trug-black%2F8593143.html,21,100,true,true,c3a38497-086d-4219-8e3a-05b9f2f17f80.png,87c4ba1f-fdf3-4629-9682-2195607000f2.jpg,20,20
32,Garden Hods,22,11,"These traditional New England garden hods are perfect for harvesting vegetables, fruits and flowers","These traditional New England garden hods are perfect for harvesting vegetables, fruits and flowers. The mesh button makes it easy to rinse and drain produce.",http://www.gardeners.com/buy/garden-hods/39-761RS.html,http://redirect.viglink.com?key=561d129541fdeb0c8f096304b858bca5&u=http%3A%2F%2Fwww.gardeners.com%2Fbuy%2Fgarden-hods%2F39-761RS.html,25,100,true,true,e97e623d-d508-468a-bdeb-d948d1c1c16e.png,93680ac0-b056-462e-8ea7-21f39ab79e24.jpg,45,50
33,Copper Indoor Watering Can,358,1,This beautiful watering can is made of pure copper throughout,This beautiful watering can was originally designed by John Haws in 1886 and is made of pure copper throughout. It features a spout that is both curved and tapered to easily navigate water flow.,http://www.amazon.com/dp/B000KKUGSQ/?tag=outgift00-20,http://www.amazon.com/dp/B000KKUGSQ/?tag=outgift00-20,25,100,false,true,cd840d0f-9a3f-40a3-bee9-c835cf2e2a34.png,e132d5bc-0837-4e00-9245-aca4dad2d68f.jpg,85,90
34,Kid’s VegTrug,24,11,The Kid's VegTrug is the perfect way to get kids growing and cultivating their own green thumbs,"The Kid's VegTrug is the perfect way to get kids growing and cultivating their own green thumbs. At 2' high, it puts crops at an easy working height for children.",http://www.gardeners.com/buy/kids-vegtrug/8590891.html,http://redirect.viglink.com?key=561d129541fdeb0c8f096304b858bca5&u=http%3A%2F%2Fwww.gardeners.com%2Fbuy%2Fkids-vegtrug%2F8590891.html,5,8,true,true,c04b2fce-47d4-4298-bfcb-37b3fbba2a69.png,d6cd39ee-d83d-42ed-80bf-45733209f86b.jpg,115,115
35,Custom Birthday Book,25,12,"This book celebrates their birthday by compiling the NYT headlines, articles and photos that marked each year","This personalized book celebrates their birthday by compiling the NYT headlines, articles and photos that marked each year starting with their first birthday.",https://www.nytimes.com/store/new-york-times-custom-birthday-book.html,https://click.linksynergy.com/link?id=uavrtojNW10&offerid=486358.11384188746&type=2&murl=https%3A%2F%2Fnytstore.myshopify.com%2Fproducts%2Fthe-custom-birthday-book%3Fgdffi%3D9816abd0fd324f14989b242fa6cbf064%26gdfms%3DF0A86E0A7ABD4F079FAA7EECDBEA51E6,40,100,true,true,1fb19dbb-1b24-47fb-9d99-4d0a51daa12d.png,f39bd83f-16fa-4c20-aca5-618c97a060ab.jpg,130,130
36,Pet Treat Cam,26,1,This Wifi pet camera and treat dispenser is the perfect way to keep them connected with their furry friends,"This Wifi pet camera and treat dispenser is the perfect way to keep them connected with their furry friends from anywhere. They can say say hello, dispense their pet's favorite treat and capture candid photos.",http://www.amazon.com/dp/B008U73C46/?tag=outgift00-20,http://www.amazon.com/dp/B008U73C46/?tag=outgift00-20,21,100,true,true,c7c7388a-1299-4bdc-b01b-6fed571cdf11.png,816593df-3582-4e2a-be7f-ec39a4a9a291.jpg,170,170
37,Luxe Faux Fur Throw,27,13,These sumptuous throws are artfully woven from finely spun strands to re-create the softness of genuine fur,"These sumptuous throws are artfully woven from finely spun strands to beautifully re-create the natural weight, depth of color and indulgent softness of genuine fur. Comes in multiple colors and sizes.",https://www.restorationhardware.com/catalog/category/products.jsp?cellBackground=false&link=FauxFurThrows&categoryId=cat2850001,https://www.restorationhardware.com/catalog/category/products.jsp?cellBackground=false&link=FauxFurThrows&categoryId=cat2850001,25,100,false,true,71da88de-a31d-4d6e-9c3e-4c63d83d3bee.png,7d9a35f6-2c1b-45e8-8663-e6a713d2c502.jpeg,139,249
38,FlipBelt,28,1,"The FlipBelt is a simple but revolutionary way to go hands free for runners, hikers, bikers, and travelers","The FlipBelt is a simple but revolutionary way to go hands free for runners, hikers, bikers, and travelers. The no-bounce feature allows them to comfortably and conveniently store everything from keys to a phone.",http://www.amazon.com/dp/B012CW3122/?tag=outgift00-20,http://www.amazon.com/dp/B012CW3122/?tag=outgift00-20,17,100,true,true,e01b88cb-be1e-4cb0-bf5a-bbc9257d1769.png,fd67d3ae-4794-48c7-acbf-5012dc8efb3f.jpg,20,30
39,M-Tote Voyageur,29,14,"This versatile, durable and monogrammable Tumi tote is great for everyday and business travel","This versatile, durable and monogrammable Tumi tote is great for everyday and business travel. It features a padded laptop compartment, a zip entry, multiple pockets and a hidden cellphone pocket. Free monogramming available.",http://www.tumi.com/p/m-tote-0494766D,http://fxo.co/4nH6,21,100,false,true,e17efab2-ee74-4b22-b924-cb835e6a1439.png,ccdd1d5c-5a36-408d-aa2a-6c62d2d83545.jpeg,235,235
40,FinePix Waterproof Digital Camera,9,1,"Tough enough to shoot in all situations, the FinePix XP90 is waterproof, freezeproof, shockproof and dustproof","Tough enough to shoot in all situations, the FinePix XP90 is waterproof, freezeproof, shockproof and dustproof. It features a 5x optical zoomlens, Wi-Fi sharing and time lapse movie capability.",http://amzn.to/2DDEg4F,http://amzn.to/2DDEg4F,18,100,true,true,6c05a293-6bbf-431a-92ab-263a0029adbd.png,10971676-bda5-433c-9234-4792c5692e38.jpg,150,150
41,Men's Cathedral Peak Front-Zip Fleece Vest,30,1,"This hugely popular classic fleece vest from Columbia will keep him warm while camping, hiking or out on the slopes",This hugely popular classic fleece vest from Columbia is a key layering piece for outdoors adventures or everyday excursions. A zip-closed security pocket keeps valuables stashed safely. Multiple colors available.,http://www.amazon.com/dp/B00DJRKKK6/?tag=outgift00-20,http://www.amazon.com/dp/B00DJRKKK6/?tag=outgift00-20,18,100,true,false,2924943f-9a73-4d1b-95be-647b5ac96d37.png,6720d375-d957-4508-8a8c-81e64c07a7d6.jpg,20,70
43,Pressurized Growler for Craft Beer,32,1,The uKeg 64 growler keeps craft beer fresh and cold all day at parties and BBQs,"The stainless steel uKeg 64 ounce growler is vacuum insulated to keep beer fresh and cold all day. It's easy to fill, use and clean and perfect for parties and BBQs.",http://www.amazon.com/dp/B00YR9NUEI/?tag=outgift00-20,http://www.amazon.com/dp/B00YR9NUEI/?tag=outgift00-20,20,100,true,false,20b28ada-a627-447a-8162-b346c23ec047.png,f2812977-d823-4ee7-9c85-4aecc0f8fcd5.jpg,126,169
46,Lismore Diamond Round Decanter,34,17,This Waterford Lismore Diamond decanter will make a striking addition to his bar,This Waterford Crystal's Lismore Diamond decanter is a striking modern reinvention of the classic pattern. It makes a beautiful addition to any bar.,http://www1.bloomingdales.com/shop/product/waterford-lismore-diamond-round-decanter?ID=1253943&CategoryID=3865#fn,http://fxo.co/4muV,21,100,true,false,b26b1936-80ab-49ad-8990-5358d1cda4c4.png,05d7c2c5-1396-4be6-9308-eeea909f0e01.jpeg,295,295
48,Language Blocks,36,1,These Uncle Goose wooden blocks come in 23 different languages and are handcrafted in Michigan,"These Uncle Goose wooden blocks come in 23 different languages from French to Chinese to Hebrew. They are handcrafted in Grand Rapids, Michigan using choice materials from around the Great Lakes.",http://www.amazon.com/dp/B01CRLI1PA/?tag=outgift00-20,http://www.amazon.com/dp/B01CRLI1PA/?tag=outgift00-20,18,50,true,true,1c5306c6-4895-4ffe-b22c-d2b64b5e4dea.png,f48e1a05-d848-4082-a334-412013ea21b5.jpg,35,40
49, Language Blocks,36,1,These Uncle Goose wooden blocks come in 23 different languages and are handcrafted in Michigan,"These Uncle Goose wooden blocks come in 23 different languages from French to Chinese to Hebrew. They are handcrafted in Grand Rapids, Michigan using choice materials from around the Great Lakes.",http://www.amazon.com/dp/B01CRLI1PA/?tag=outgift00-20,http://www.amazon.com/dp/B01CRLI1PA/?tag=outgift00-20,2,4,true,true,d54e8080-f655-460e-8145-2ec793fc7265.png,a82f0730-023f-485f-b95f-bdcf7d604527.jpg,35,40
50,Leather ID Bracelet,37,19,This beautifully crafted leather and pewter ID bracelet was made in England for trendsetters,This beautifully crafted leather and pewter ID bracelet was made in England for trendsetters. It features an adjustable strap with a belt buckle closure that allows for comfortable wear and an engraved JV logo.,https://www.johnvarvatos.com/leather-and-pewter-id-plate-bracelet/M030S1-Y1065.html,http://fxo.co/4muF,18,34,true,false,5a313a1d-224e-448d-8cfd-1c47e190b700.png,cfc78d6f-9f53-492d-8daa-9a9698638cbf.jpeg,128,128
51,Classic Stainless Steel Watch,486,1,This classic round watch shows off a timeless case designed to be thin and elegant paired with a rich leather strap,This classic round watch shows off a timeless case designed to be thin and elegant paired with a rich leather strap,https://amzn.to/2Jcplls,https://amzn.to/2Jcplls,18,100,true,true,41524542-ed79-47a5-ab75-fe93f3d5aece.png,f520e7c9-6298-4fcd-a14e-a33a200bd1b4.jpg,98,98
52,Cast-Iron Round Griddle,39,1,"This pre-seasoned, cast iron cookware makes the perfect meal indoors or fireside at a camp","This pre-seasoned, cast iron cookware makes the perfect meal indoors or fireside at a camp. It features exceptional heat retention and distribution and a sturdy handle.",http://www.amazon.com/dp/B00008GKDN/?tag=outgift00-20,http://www.amazon.com/dp/B00008GKDN/?tag=outgift00-20a,25,100,true,true,d41975c2-ecd0-42fe-953d-095a1aeecf60.png,a3c0787a-7c2e-40ee-80be-855ad78107ad.jpg,15,15
53,Modern Twill Weekender,40,21,"This perfect modern, water-resistant carry-on is made of sturdy cotton twill, leather straps and gunmetal feet","This perfect modern, water-resistant carry-on is made of sturdy cotton twill, leather straps and gunmetal feet. It fits easily inside any overhead compartment.",https://www.everlane.com/collections/mens-backpacks-bags/products/mens-twill-weekender-reverse-denim-black-leather,https://redirect.viglink.com?key=561d129541fdeb0c8f096304b858bca5&u=https%3A%2F%2Fwww.everlane.com%2Fcollections%2Fmens-backpacks-bags%2Fproducts%2Fmens-twill-weekender-reverse-denim-black-leather,21,100,true,true,b0afb220-1814-4a11-a97c-d1c3c97373fd.png,6c65a140-9996-416b-a387-5fc85e975bbf.jpg,98,98
54,Roadie 20 Cooler,41,1,This cooler is built tough and highly rated to endure the heat and outdoors,"This cooler is built tough and highly rated to endure the heat and outdoors. It features foam insulation, freezer quality sealing gasket, dry ice compatibility, non-slip rubber feet, a leakproof drain plug and lockable lid.",https://www.amazon.com/dp/B004YIBWNS/?tag=outgift00-20&th=1,https://www.amazon.com/dp/B004YIBWNS/?tag=outgift00-20&th=1,18,100,true,false,bc32ab06-f74f-4435-a3e5-a61699586e5f.png,82f033b8-2d65-4d4f-8171-7f35bb76d82c.png,200,200
55,Hopper Two Cooler,41,1,This soft-shell cooler is built tough and highly rated to endure the heat and outdoors ,This soft-shell cooler is built tough and highly rated to endure the heat and outdoors. It features a DryHide™ shell made of the same leakproof material as whitewater rafts and keeps ice for days.,https://www.amazon.com/dp/B00SU9AHEC/?tag=outgift00-20&th=1,https://www.amazon.com/dp/B00SU9AHEC/?tag=outgift00-20&th=1,18,100,true,false,89877972-9a6b-4e2a-8b1b-79b94b69e868.png,1a4aa302-66ce-4cec-9c92-00da81f4815f.png,250,250
56,Advanced Hiking Backpack,142,54,"This backpack has advanced suspension systems, sturdy frames and light materials for your outdoors lover","This backpack has advanced suspension systems, sturdy frames and light materials for your outdoors lover. Multiple styles and colors available. ",http://www.ems.com/s/EMS/osprey-manta-ag-20-daypack-fossil-grey/1388049.html,https://click.linksynergy.com/link?id=uavrtojNW10&offerid=303281.6969561476&type=2&murl=http%3A%2F%2Fwww.ems.com%2Fosprey-manta-ag-28-daypack%2F27837400018.html,18,100,true,true,31e82734-b8b8-41c8-a1ce-55e8a2aad9b6.png,6b5fece3-8816-41b5-8c2c-b2d9a18948be.jpg,124,124
59,M’héritage Copper Cookware,45,25,Mauviel copper cookware exemplifies world-class French craftsmanship and is used by professionals everywhere,Mauviel copper cookware exemplifies world-class French craftsmanship and is used by professionals and experienced cooks everywhere.,http://www.surlatable.com/product/PRO-1140615/Mauviel+Mheritage+150s+7-Piece+Set,http://fxo.co/4nGo,21,100,true,true,16ffbdc3-a351-4ac7-84c2-867a13b59420.jpg,95cfcb00-b91d-42ac-ae45-50514adf10a4.jpeg,900,900
60,Convertible Leather Shoulder Bag,46,26,This beautiful leather purse is from a renown luxury house and converts from shoulder at work to a clutch at night,"This beautiful leather purse from Salvatore Ferragamo, a renown Italian luxury house, converts from shoulder at work to a clutch at night. It features a detachable shoulder chain and magnetic snap flap closure.",http://www.saksfifthavenue.com/main/ProductDetail.jsp?FOLDER%3C%3Efolder_id=2534374306622829&PRODUCT%3C%3Eprd_id=845524446677805&R=8050445352631&P_name=Salvatore+Ferragamo&N=4294912431+306622829&bmUID=lA90Xar,http://redirect.viglink.com?key=561d129541fdeb0c8f096304b858bca5&u=http%3A%2F%2Fwww.saksfifthavenue.com%2Fmain%2FProductDetail.jsp%3FFOLDER%253C%253Efolder_id%3D2534374306622829%26PRODUCT%253C%253Eprd_id%3D845524446677805%26R%3D8050445352631%26P_name%3DSalvatore%2BFerragamo%26N%3D4294912431%2B306622829%26bmUID%3DlA90Xar,21,54,false,true,2da8a98a-5f27-45bf-9bc3-e67b66c81ebb.png,0bb884d0-dfb1-467b-b557-7652c482a34d.png,750,750
61,Châtelaine Diamond Bracelet,180,17,Get her this iconic bracelet from the Châtelaine Collection that is a fashion statement as well as a work of art,Get her this iconic bracelet from David Yurman's Châtelaine Collection that is a fashion statement as well as a work of art. It features sterling silver and pavé diamonds.,https://www.bloomingdales.com/shop/product/david-yurman-chatelaine-petite-bracelet-with-diamonds?ID=1654873&pla_country=US&cm_mmc=Google-PLA-ADC-_-Jewelry%20%26%20Accessories-NA-_-David%20Yurman-_-883932775327USA&CAWELAID=120156070002728719&CAGPSPN=pla&CAAGID=51934832288&CATCI=pla-570135992552&CATARGETID=120156070005983313&cadevice=c&gclid=Cj0KCQjw4eXPBRCtARIsADvOjY0KJ6i-Bm30kaWf3x9ndk6sQKMsMLcvRJJxX_Rk-1QHm5vWOiwHG-AaAgEDEALw_wcB,http://fxo.co/571n,24,100,false,true,dd9f048c-9ed9-488f-aae5-4dc4d272a828.png,40a9c205-a020-4ead-9c37-ba7f0b8221e2.jpeg,750,750
