id,name,brand_id,retailer_id,feature_description,detailed_description,product_link,affiliate_link,min_age,max_age,male,female,picture,detail_picture,min_price,max_price
892,Humidifier and Essential Oil Diffuser,484,1,This highly rated cool mist humidifier and essential oil diffuser is quiet and can work continuously for up to 10 hours,This highly rated cool mist humidifier and essential oil diffuser is quiet and can work continuously for up to 10 hours.  It comes in multiple colors.,amazon.com/dp/B018CLNEOM/?tag=outgift00-20,amazon.com/dp/B018CLNEOM/?tag=outgift00-20,25,100,false,true,e8149d18-495b-46ac-8562-609d9cc7660a.png,b492061d-d57e-4812-9084-b2a82d868cd9.jpg,25,30
893,The Baby Owner's Manual,356,1,The Baby Owner's Manual explores hundreds of frequently asked questions using step-by-step instructions and schematic designs,The Baby Owner's Manual explores hundreds of frequently asked questions using step-by-step instructions and schematic designs.  ,amazon.com/dp/1594745978/?tag=outgift00-20,amazon.com/dp/1594745978/?tag=outgift00-20,18,45,true,true,db9368bb-613e-4bab-b1b9-6772b51e528c.png,5ed7a7f7-8696-4b2f-8694-02a02aa81fed.jpg,10,10
894,Smart Sock 2 Baby Monitor,1,1,Give the new mama piece of mind with this smart sock that track's the infants heart rate and oxygen levels,Give the new mama piece of mind with this smart sock that track's the infants heart rate and oxygen levels and notifies parents in real-time if something appears to be wrong.,amazon.com/dp/B06ZZXYD6S/?tag=outgift00-20,amazon.com/dp/B06ZZXYD6S/?tag=outgift00-20,18,45,true,true,95c85b50-bebe-43a5-97ee-7e6bbebe7a85.png,cca6c2b6-9e51-413a-9a10-eda499f59082.jpg,300,300
895,Babycook Steam Cooker and Blende,485,1,This handy device prepare food from raw to any stage baby and toddler food in 15 minutes,"This handy device prepare food from raw to any stage baby and toddler food in 15 minutes.  It features an unique, one-handed operation with patented steam heating system and comes in multiple color options.",amazon.com/dp/B0721T81TZ/?tag=outgift00-20,amazon.com/dp/B0721T81TZ/?tag=outgift00-20,18,45,true,true,fc00af59-6afa-478e-8b0b-ed3eb0074196.png,8299e7f2-a231-400e-a476-82745e0eb3bf.jpg,150,150
896,Smart Night Light and Sound Machine,294,1,"Rest combines nightlight, sound machine, and time-to-rise alert in one easy-to-use device that can be controlled from a phone","Rest combines nightlight, sound machine, and time-to-rise alert in one easy-to-use device that can be controlled from a phone.  It can be easily programmed and grows with a child's needs.",amazon.com/dp/B06XMRCC94/?tag=outgift00-20,amazon.com/dp/B06XMRCC94/?tag=outgift00-20,18,45,true,true,0baaa268-9c91-42cf-a728-e89e07e6899d.png,cfeaacdb-7d80-4437-98e9-4916d8a894a2.jpg,60,60
897,Sit-to-Stand Learning Walker,367,1,This best selling interactive learning baby walker features a removable toddler play panel that develops fine motor skills,This best selling interactive learning baby walker features a removable toddler play panel that develops fine motor skills.  Comes in multiple color options. ,amazon.com/dp/B0053X62GK/?tag=outgift00-20,amazon.com/dp/B0053X62GK/?tag=outgift00-20,18,45,true,true,93baaf64-3910-4042-b359-b45ed292bcc9.png,36dd00fa-4617-4784-a651-67e0ffd40037.jpg,20,30
898,Sit-to-Stand Learning Walker,367,1,This best selling interactive learning baby walker features a removable toddler play panel that develops fine motor skills,This best selling interactive learning baby walker features a removable toddler play panel that develops fine motor skills.  Comes in multiple color options. ,amazon.com/dp/B0053X62GK/?tag=outgift00-20,amazon.com/dp/B0053X62GK/?tag=outgift00-20,0,1,true,true,41eb779f-a45a-4475-b874-8ebc81baa9a6.png,f4d75a4e-d741-4a77-9491-befda920a75e.jpg,20,30
899,Laugh & Learn Smart Stages Crawl Around Car,192,1,"This stationary car encourages baby to sit up, crawl, pull up, stand and move all around","This stationary car encourages baby to sit up, crawl, pull up, stand and move all around.  It features a built-in ramp for ball play, 75 songs and phrases and three Smart Stage levels of play.",amazon.com/dp/B00UCWQMZ8/?tag=outgift00-20,amazon.com/dp/B00UCWQMZ8/?tag=outgift00-20,0,3,true,true,73ab421a-07dd-4e99-81e9-01ddef14af03.png,b94164f7-6392-47a3-9dbd-a0f2047f6053.jpg,50,50
900,Delicate Velvet Leather Watch,488,151,This watch has a slender case and velvety nubuck leather strap with delicate metal rings decorating the strap,This watch has a slender case and velvety nubuck leather strap with delicate metal rings decorating the strap. Comes in multiple color and style options.,https://www.rosefieldwatches.com/us/watches?gclid=Cj0KCQiA7dHSBRDEARIsAJhAHwglusa4X-2A9hOHJSgWmawt4BNhEQQVbLwjkJPl2fUSDMLYN0pp7BUaAgaEEALw_wcB,https://redirect.viglink.com?key=561d129541fdeb0c8f096304b858bca5&u=https%3A%2F%2Fwww.rosefieldwatches.com%2Fus%2Fwatches%3Fgclid%3DCj0KCQiA7dHSBRDEARIsAJhAHwglusa4X-2A9hOHJSgWmawt4BNhEQQVbLwjkJPl2fUSDMLYN0pp7BUaAgaEEALw_wcB,16,100,false,true,05043941-ad38-4c9d-a69e-96d244b6f55c.png,b29a5b4a-19ee-4932-a048-1c34323f2f12.JPG,99,119
901,Mini Grand Piano,487,1,This learn-to-play kids grand piano has 30 great sounding keys and will spark their interest in learning music,This learn-to-play kids grand piano has 30 great sounding keys and will spark their interest in learning music. It's durable and painted with environmentally friendly paint. Comes in black or pink.,http://amzn.to/2Dkicgc,http://amzn.to/2Dkicgc,5,10,true,true,f61e06ca-ce7f-451e-a335-6cd85b232d1e.png,c7ef2c54-1197-4e95-add9-9387d7d8ec15.jpg,65,65
902,Penguin Print House Framed Print,489,152,These limited edition prints from beloved children’s books are sure to bring imagination to any room,"These limited edition prints from beloved children’s books are sure to bring imagination to any room.  Choose prints from Corduroy, Llama Llama Red Pajama, Dragons Love Tacos and more.",https://www.framebridge.com/penguin/,http://bit.ly/2F0mh9M,0,10,true,true,748dc3b7-a621-4181-924a-4766d14b9daf.png,e4b777d5-f311-4568-9083-1bb4a68ff647.jpg,150,300
903,Monogram Leather Chain Shoulder Bag,391,26,"This petite monogram shoulder bag with a bold chain is reminiscent of the YSL heritage, making it a staple wardrobe piece","This petite monogram shoulder bag with a bold chain is reminiscent of the YSL heritage, making it a staple wardrobe piece. Comes in multiple color options. ",https://www.saksfifthavenue.com/main/ProductDetail.jsp?PRODUCT%3C%3Eprd_id=845524446695623,http://fxo.co/573M,18,100,false,true,5a97e258-abc8-478f-ab84-937aa4442598.png,8404d39c-6b27-4ab4-8e9d-249dff1a6f3a.jpeg,620,1750
904,Little People Dump Truck,192,1,"This cute dump truck comes equipped with realistic truck sounds, fun phrases and music","This cute dump truck comes equipped with realistic truck sounds, fun phrases and music.  Includes dump truck, construction worker figure & boulder piece.",http://amzn.to/2rq29w7,http://amzn.to/2rq29w7,1,4,true,false,89788d11-e504-4e34-9df0-e02f93cf1de3.png,fec3d6ef-0ad8-4818-b29f-e64ec610b1f8.jpg,10,15
905,Foldable Travel Duffel,490,1,"This foldable, nylon travel duffel is waterproof and tear resistant","This foldable, nylon travel duffel is waterproof and tear resistant.  Multiple color options available. ",http://amzn.to/2DhfiZv,http://amzn.to/2DhfiZv,18,100,true,true,c7fbd75c-2ab1-4944-83a5-74fe87818b13.png,f4316b98-fee2-47d8-a1d2-a65518c336a6.jpg,9,9
906,Vara Leather Bow Continental Wallet,46,26,This textured leather wallet with striking goldtone hardware was made in Italy,"This textured leather wallet with striking goldtone hardware was made in Italy.  It features a flap with button closure, one inside zip divider pocket, one inside bill compartment and six inside credit card slots. ",https://www.saksfifthavenue.com/main/ProductDetail.jsp?PRODUCT%3C%3Eprd_id=845524447083067,http://fxo.co/573b,18,100,false,true,41cdc4be-f42d-4cae-b003-7eea9471c7f4.png,c04a594b-5abc-435b-89e9-73ce4cf03a1e.JPG,495,495
907,Vara Leather Card Case,46,26,This textured leather flip card case adorned with a bow is a simple and cute way to store cards,"This textured leather flip card case adorned with a bow is a simple and cute way to store cards. Features gold tone hardware, one outside card slot and multiple inside card slots. ",https://www.saksfifthavenue.com/main/ProductDetail.jsp?PRODUCT%3C%3Eprd_id=845524447144315,http://fxo.co/573e,18,100,false,true,73d1ec0f-4031-499a-a947-f90f61d0770f.png,f50f8c03-991c-4989-b280-fc29cc89374c.png,168,168
908,Vara Leather Crossbody Bag,46,26,"This elegant, leather crossbody bag comes accented with logo etched hardware and a delicate bow","This elegant, leather crossbody bag is made in Italy and comes accented with logo etched hardware and a delicate bow. ",https://shop.nordstrom.com/s/salvatore-ferragamo-vara-leather-crossbody-bag/4712283?origin=coordinating-4712283-0-3-PDP_1-recbot-also_viewed2&recs_placement=PDP_1&recs_strategy=also_viewed2&recs_source=recbot&recs_page_type=product,http://fxo.co/573f,18,100,false,true,5a7dba03-08b6-4889-bafc-c381657d6107.png,6cf2ed81-0f39-4f26-a8f1-43807df8a455.jpg,775,775
909,Cameron Street Lucie,87,65,This luxurious tote features a dropped zip-top closure to keep belongings safe and comes with a matching luggage tag,"This luxurious, black crosshatched leather tote features a dropped zip-top closure to keep belongings safe and comes with a matching luggage tag.",https://www.katespade.com/products/cameron-street-lucie/PXRU6921.html,http://fxo.co/573l,18,100,false,true,6cb20cff-fb9b-4721-a8aa-aaeeb1079bee.png,b426f08e-243b-4dba-b882-2ad395eb6a4a.jpg,298,298
910,Cameron Street Maise,87,65,"This go-anywhere, carry-everything bag with an adjustable, removable cross-body strap transitions from work to weekend","This go-anywhere, carry-everything bag with an adjustable, removable cross-body strap transitions from work to weekend. Comes in multiple color options. ",https://www.katespade.com/products/cameron-street-maise/098687150996.html,http://fxo.co/573p,18,100,false,true,3d686e88-1546-47b1-906c-740f6bac73c0.png,583aebf4-07ff-400c-a24c-7623315cf5e4.jpg,298,298
911,Swarovski Crystal Petite Stud Earrings,87,65,These petite studs set Swarovski crystals against gold-and rhodium- plated metal for a sublime effect,These petite studs set Swarovski crystals against gold-and rhodium- plated metal for a sublime effect. Comes in multiple color options. ,https://www.katespade.com/products/rise-and-shine-small-studs/098686618473.html,http://fxo.co/57Ml,12,100,false,true,f1192d02-377f-4f14-92d0-3d917f453a31.png,66bf677f-50cf-4912-8c44-35cf2a009ba2.jpg,38,38
912,Carlyle Street Marci Crossbody,87,65,"This beautiful, vegetable tanned leather crossbody bag comes with satin lining and a push-lock closure","This beautiful, vegetable tanned leather crossbody bag comes with satin lining and a push-lock closure. ",https://www.katespade.com/products/carlyle-street-marci/PXRU8482.html,http://fxo.co/573r,16,34,false,true,05450cf3-21e6-4c2c-9854-d1a52a0a2fee.png,1afb1c7b-da40-4f53-af29-3ed4be5dd858.jpg,314,314
913,That's the Spirit Gym Duffel,87,65,This supple nylon gym bag is the perfect accessory for the active traveler in your life,"This supple nylon gym bag is the perfect accessory for the active traveler in your life. It features spade jacquard lining, zipper closure, an exterior front slip pocket, interior front pockets that can store shoes and other necessities and an interior zipper pocket. ",https://www.katespade.com/products/that%C2%92s-the-spirit-xxl-lane/PXRU8864.html,http://fxo.co/573v,18,100,false,true,fb9c4dbc-d229-43b8-a83e-f5afe376b2fe.png,d45ee6eb-b7d1-4bfa-8fa5-b81d5ab6b2a3.jpg,348,348
914,Crossbody iPhone Case,87,65,"This crossbody iPhone case is perfect for stashing pennies, credit cards, IDs, and of course an iPhone","This crossbody iPhone case is perfect for stashing pennies, credit cards, IDs, and of course an iPhone. It features pebbled leather with matte finish with matching trim. 
 Comes in multiple color options. ",https://www.katespade.com/products/north-south-crossbody/8ARU2106.html?dwvar_8ARU2106_color=950&dwvar_8ARU2106_size=UNS,http://fxo.co/5749,11,17,false,true,624eb566-d962-4baa-922e-295f09daa590.png,b12c5660-7641-421a-b674-dd4845df9c33.jpg,128,128
915,Kenna Yoga Bag,87,65,The oversized bow on this roomy tote isn't only for decoration; the sides unzip to allow them to stash a yoga mat,"The oversized bow on this roomy tote isn't only for decoration; the sides unzip to allow them to stash a yoga mat. It is made of twill nylon and smooth leather and a zipper closure, interiror zip pocket and a double interior slide pocket.",https://www.katespade.com/products/haring-lane-kenna-yoga-bag/PXRU7801.html,http://fxo.co/573x,18,65,false,true,20f64a25-6a71-4f89-919f-023a1226ee78.png,b13cc41d-1da2-4bf0-b663-36406cca4483.jpg,298,298
916,Mini Square Studs,87,65,"These square studs, specially-faceted for extra shine in a delicious array of colors, will lend any look a touch of sparkle","These square studs, specially-faceted for extra shine in a delicious array of colors, will lend any look a touch of sparkle.  Made of gold plated metal with cubic zirconia. ",https://www.katespade.com/products/mini-small-square-studs/WBRUD847.html,http://fxo.co/573z,15,100,false,true,14a88a6b-479f-4413-ba05-7ecb4c503379.png,b6e3588f-49fa-4fc5-844a-601b0bb00bdb.jpg,32,32
917,Leather Bow Bangle,87,65,"This sweet bangle features a magnetic hinged closure and a pretty, polished and playful leather bow","This sweet bangle features a magnetic hinged closure and a pretty, polished and playful leather bow",https://www.katespade.com/products/perfectly-placed-hinged-leather-bow-bangle/WBRUA200.html,http://fxo.co/5743,16,44,false,true,d09dad35-d68b-432e-b31c-9c439fc5f5ba.png,30fb2d06-afa6-4e19-ba1d-eabc40c5d638.jpg,98,98
918,Monogrammable Leather Bow Wrap,87,65,This simple leather band adorned with a bow can be monogrammed for a personal touch,This simple leather band adorned with a bow can be monogrammed for a personal touch. ,https://www.katespade.com/products/wrap-things-up-leather-bow-wrap-bracelet/WBRUD210.html,http://fxo.co/5741,16,24,false,true,ef3573b6-f7d1-43a1-bdd8-63e17f22a7b9.png,58131cd9-2780-4505-a32f-edb7f4ec4aad.jpg,55,65
919,Sunglass iPhone Case and Stand,87,65,This case will keep digital devices safely covered with a whimsical sunglass design that doubles as a stand,This case will keep digital devices safely covered with a whimsical sunglass design that doubles as a stand,https://www.katespade.com/products/silicone-sunglass-stand-iphone-x-case/8ARU2287.html,http://fxo.co/5747,11,17,false,true,18dde616-dc09-4478-9f02-9aa1b6a5bee1.png,f73030dc-b673-400b-bf17-b356f6d84ad7.jpg,46,46
920,Cameron Street Lainie,87,65,"This crosshatched leather wristlet is made for stashing pennies, credit cards and IDs","This crosshatched leather wristlet is made for stashing pennies, credit cards and IDs. Comes in multiple color options. ",https://www.katespade.com/products/cameron-street-lainie/098687148900.html,http://fxo.co/574C,16,100,false,true,641a16bf-b18b-49c1-a55a-c51a4b47b827.png,860d6c23-1375-42ce-a8da-56d6ed9a7237.jpg,88,88
921,Babe Mug,259,101,This polished ceramic graphic mug is a great gift for your babe or BFF,This polished ceramic graphic mug is a great gift for your babe or BFF. ,https://www.urbanoutfitters.com/shop/babe-mug?category=dinnerware&color=066,http://fxo.co/57GN,14,24,false,true,e09ecbdd-9b74-4b28-abe4-1dbdc18ec188.png,9ee3c4a7-2f58-48e1-bb1a-9fb87a940898.jpg,10,10
922,Corkcicle Air,498,1,"This nifty device is a wine chiller, aerator, pourer, stopper in one","This nifty device is a wine chiller, aerator, pourer, stopper in one. ",http://amzn.to/2BeYCjA,http://amzn.to/2BeYCjA,21,100,true,true,a46cd470-f5f9-4df4-b3ba-6420420d184f.png,f3ab73ad-d9b1-4d2b-b5d7-54c6c7ea0e13.jpg,25,25
923,Matcha Moisture Stick,491,1,This matcha moisture stick helps rejuvenate dry spots and protects skin from free radical damage,This matcha moisture stick helps rejuvenate dry spots and protects skin from free radical damage. ,http://amzn.to/2EVNQ44,http://amzn.to/2EVNQ44,18,100,true,true,0538d87d-0093-434d-9d1a-7276f5bc5a55.png,f483495d-b0cf-4fa5-8edb-ccf6fe949b91.jpg,10,10
924,Age Prevention Superfood Mask,492,38,"This mask feeds skin with superfoods: spirulina, microalgae, kale and spinach","This mask feeds skin with superfoods: spirulina, microalgae, kale and spinach. ",https://www.sephora.com/product/spirulina-microalgae-kale-spinach-age-prevention-superfood-mask-P417939,http://fxo.co/57H1,21,100,true,true,800048b3-3cfe-478e-b43b-a523c964c085.png,246cf654-4a6e-495a-b9b0-5a46c90323a7.jpg,44,44
925,Cocktails with Benefits,356,1,"For the healthnut that also loves cocktails, this book gives them nutritious twists on well-known classics","For the healthnut that also loves cocktails, this book gives them nutritious twists on well-known classics. ",http://amzn.to/2FVwXrN,http://amzn.to/2FVwXrN,21,100,true,true,05d487fe-8659-4f71-a915-a84c832f102a.jpg,1b813617-f24a-4b83-aac0-15f881163780.jpg,10,10
926,Mighty Blemish Patch,493,1,This patch is a new way to battle those pesky blemishes without harsh chemicals or drying formulas for results overnight,This patch is a new way to battle those pesky blemishes without harsh chemicals or drying formulas for results overnight.  Perfect for travelers.,http://amzn.to/2DiNCnm,http://amzn.to/2DiNCnm,12,34,true,true,ea76cd45-b795-47c7-8af2-6a77557b58da.png,70e78f94-c85e-4c8a-ad39-8b37a435c352.jpg,12,13
927,Stay Cool Corkcicle ,356,1,"This stylish, durable canteen will keep drinks cold for over 25 hours, hot for over 12 hours","This stylish, durable canteen will keep drinks cold for over 25 hours, hot for over 12 hours. Comes in multiple colors.",http://amzn.to/2mSwopQ,http://amzn.to/2mSwopQ,15,100,true,true,c732c3f8-2436-4e34-bc35-d17480e287f6.png,36ca1842-2696-4dd9-a919-5af509617bc7.jpg,20,35
928,Fleece Lined Robe,411,1,"This robe is crafted from soft cotton jersey and lined with plush fleece for relaxed fit and lightweight, luxurious feel","This robe is crafted from soft cotton jersey and lined with plush fleece for relaxed fit and lightweight, luxurious feel",http://amzn.to/2Bdo9Ke,http://amzn.to/2Bdo9Ke,18,100,true,false,e2985a99-29cc-4ffc-b930-6449b63004f9.png,b7d2b14e-6dff-40ba-98ca-52feef4a8da6.jpg,100,145
929,Coconut Milk Bath Soak,412,38,This luxurious and indulgent bath soak with skin-softening organic coconut milk is perfect for hydrating and softening skin,This luxurious and indulgent bath soak with skin-softening organic coconut milk is perfect for hydrating and softening skin,https://shop.nordstrom.com/s/herbivore-botanicals-coconut-soak/4377682,http://fxo.co/57Hg,21,100,false,true,c4143719-6b23-437b-8391-b301a3450ad8.png,5e83f1ec-4361-4cb0-b957-df4caf4744ed.jpg,18,32
930,Rose Mask Set,494,1,This mask is comprised of 12 individual skin rejuvenating petals infused with the scent and the essence of rose,This mask is comprised of 12 individual skin rejuvenating petals infused with the scent and the essence of rose.,http://amzn.to/2FXYmJA,http://amzn.to/2FXYmJA,18,100,false,true,d4361745-3cf6-480c-9620-7c092e30a881.jpg,fd81dcc5-ec7f-447f-9341-64d6be54c9cb.jpg,40,40
931,Date Night In,356,1,This book of 120 delicious recipes will rekindle the romance at home with a weekly date night,"This book of 120 delicious recipes will rekindle the romance at home with a weekly, home-made date night meal for two.",http://amzn.to/2EUTTWs,http://amzn.to/2EUTTWs,21,100,true,true,0fb609d0-67f4-44e2-a21d-90104844ce49.jpg,53197799-1423-4a6a-91b4-e1ebab6bb3cc.jpg,20,25
932,Hair Sweet Hair Gummies,496,38,"These delicious, berry-flavored vegan gummy supplements promote hair growth and health, leaving their hair with ample shine","These delicious, berry-flavored vegan gummy supplements promote hair growth and health, leaving their hair with ample shine",https://www.sephora.com/product/hair-sweet-hair-P415922,http://fxo.co/57Hm,18,100,false,true,806747d6-ee01-4396-a6cc-43ca28e52d3f.png,59e3fb1c-3868-4ac1-9934-39ff34a68d36.jpg,25,25
933,Helsinki Wireless Portable Speaker,497,1,This portable and wireless Bluetooth speaker offers high-quality sound and reliable connectivity between devices,"This portable and wireless Bluetooth speaker offers high-quality sound and reliable connectivity between devices. It includes Vifa Helsinki speaker, a short leather strap, power supply, AUX 3.5mm mini jack cable, manual, quick guide, travel bag, and warranty. Multiple color options available.",http://amzn.to/2DQLog5,http://amzn.to/2DQLog5,16,100,true,true,3517f596-0ee9-4c21-aa86-dcac2089dc21.png,37af3aa8-8c0e-4427-94c8-cb1aa8c4b269.jpg,449,449
934,Post Shave Balm,495,1,"This lightweight, comforting balm helps to soothe razor burn and leaves skin fresh and smooth","This lightweight, comforting balm helps to soothe razor burn and leaves skin fresh and smooth.",http://amzn.to/2DiV69N,http://amzn.to/2DiV69N,18,100,true,false,6305ab53-69b2-4990-88aa-6fcf568d7358.png,9e0f3089-84ae-4828-9d5c-3cb4c1b6a37b.jpg,49,49
935,Rejuvenating Shave Oil,495,1,"For the ultimate close shave, get him this rejuvenating and nourishing shave oil, packed with essential oils.","For the ultimate close shave, get him this rejuvenating and nourishing shave oil, packed with essential oils.",http://amzn.to/2FUo6Xd,http://amzn.to/2FUo6Xd,18,100,true,false,faac7611-9380-47ef-b79d-b682da62925f.png,10422718-13f3-4108-aada-2c800609a8e8.jpg,44,44
936,Digital Mini Toy Piano,499,1,"This tiny, easily transportable piano delivers the stable pitch expected from a real digital piano","This tiny, easily transportable piano delivers the stable pitch expected from a real digital piano.  It's powered by AA batteries, comes with 50 built-in demo songs and built in speakers.",http://amzn.to/2FVOUpU,http://amzn.to/2FVOUpU,1,4,true,true,fbb47f03-6fd8-411b-ba20-16164240070c.png,3fb08eff-6fca-4e4b-9e34-51217bd61033.jpg,240,245
937,Elmo Hooded Towel ,534,64,"With a velour exterior, terry interior and snuggly hood, this Elmo towel is sure to become a bath time favorite","With a velour exterior, terry interior and snuggly hood, this Elmo towel is sure to become a bath time favorite",https://www.crateandbarrel.com/sesame-street-elmo-hooded-towel/s465458,http://www.anrdoezrs.net/links/8068766/type/dlg/https://www.crateandbarrel.com/sesame-street-elmo-hooded-towel/s465458,0,4,true,true,b4787a29-9f61-4e8a-b08c-c3bba19ec3ce.png,65bc4332-1482-4304-a273-7912353f6263.jpg,45,45
938,Giant Cookie Monster Plush Toy,534,64,"Made for huge hugs and so much snuggling, this Giant Cookie Monster Plush Toy is soft yet strong enough for plenty of play","Made for huge hugs and so much snuggling, this Giant Cookie Monster Plush Toy is soft yet strong enough for plenty of play",https://www.crateandbarrel.com/sesame-street-cookie-monster-giant-plush-toy/s467873,http://www.anrdoezrs.net/links/8068766/type/dlg/https://www.crateandbarrel.com/sesame-street-cookie-monster-giant-plush-toy/s467873,0,4,true,true,4a10581f-094e-4826-b496-ca51ac78ccca.png,315cb46f-d6d8-46da-bf71-881e1d9c7bf4.jpg,149,149
939,Sesame Street Piggybank,534,64,"Constructed from sturdy stoneware, this Sesame Street Piggy Bank can also double decor or a unique bookend","Constructed from sturdy stoneware, this Sesame Street Piggy Bank can also double decor or a unique bookend. Multiple Sesame Street characters available.",https://www.crateandbarrel.com/sesame-street-cookie-monster-piggy-bank/s491067,http://www.anrdoezrs.net/links/8068766/type/dlg/https://www.crateandbarrel.com/sesame-street-cookie-monster-piggy-bank/s491067,0,4,true,true,7caa8a29-8195-4a0b-8d9a-4148de8c1c36.png,2b9e20ec-9e6b-4ec5-b304-415a7b842216.jpg,20,25
940,Larry the Llama,534,64,"Larry the Llama is beautifully designed, extra fuzzy and soft, and sturdy enough for little ones","Larry the Llama is beautifully designed, extra fuzzy and soft, and sturdy enough for little ones",https://www.crateandbarrel.com/ride-on-llama/s486335,http://www.anrdoezrs.net/links/8068766/type/dlg/https://www.crateandbarrel.com/ride-on-llama/s486335,1,4,true,true,9e8d61fb-ac7f-420e-a59f-3bbb20165a98.png,949c35fc-88fc-47cf-80cd-745758ce9a0d.jpg,149,149
941,Sesame Street Baby Activity Chair,534,64,"This Baby Activity Seat features a lineup of instantly recognizable friends who will help little ones laugh, play and explore","This Baby Activity Seat features a lineup of instantly recognizable friends who will help little ones laugh, play and explore",https://www.crateandbarrel.com/sesame-street-baby-activity-chair/s490505,http://www.anrdoezrs.net/links/8068766/type/dlg/https://www.crateandbarrel.com/sesame-street-baby-activity-chair/s490505,0,1,true,true,451ec3df-3a83-4341-9c03-e1ba56f0047c.png,1a270a9d-8e08-478c-a53b-a671a3fca42f.jpg,129,129
942,Sesame Street Rug,534,64,"This rug has an interactive design featuring the neighborhood locations, streets and characters that kids love","This rug has an interactive design featuring the neighborhood locations, streets and characters that kids love",https://www.crateandbarrel.com/sesame-street-neighborhood-4-x-6-rug/s464301,http://www.anrdoezrs.net/links/8068766/type/dlg/https://www.crateandbarrel.com/sesame-street-neighborhood-4-x-6-rug/s464301,0,4,true,true,15c78bce-7609-4c04-86f4-ffb9d6994380.png,dbf9437f-e17a-4f84-944a-80723b8fec96.jpg,299,299
